"vItemNumber","vLocation","vDescription","vShortDesc","vLook","vSpecificColor","vGenColor","vGenMaterial","vGenItemType","vShape","vSizeType","vMetalColor","vMetalType","vDimensions","vPcCounts","vKeywords","vOnSale","vFeaturedItem","vSorting","vAggregation","itemprice_1","itemprice_2","quantityonhand","imagefilename"
"34734700","900","Fun Pack of multicolor skull beads are great for any large bead projects or group bead projects. Entertain and add a dash of spooky fun to create unique projects that will put a smile on your little crafters faces.","60pc Acrylic Multicolor Skull Beads","Kids","","Multi","Acrylic","Acrylic Beads","Skull",,"","","13x12mm","60","Fun pack, halloween, kids craft, skull beads, acrylic beads, multicolor","","N",999999,"",1,0,396,"http://www.clearancebeads.com/diyimages/34734700.jpg, http://www.clearancebeads.com/diyimages/34734700-2.jpg, http://www.clearancebeads.com/diyimages/34734700-3.jpg, http://www.clearancebeads.com/diyimages/34734700-4.jpg, http://www.clearancebeads.com/diyimages/34734700-5.jpg"
"34712143","900","This vibrant gold pinch bail adds spice to your homemade jewelry creations. Finish off your custom necklaces with this beautiful bail.","3pc Metal Gold Pinch Bail","Findings","","Gold","Base Metal","Misc Tools","",,"Gold","Copper","20x7mm","3","findings; gold; pinch bail","","N",999999,"",1,0,352,"http://www.clearancebeads.com/diyimages/34712143.jpg, http://www.clearancebeads.com/diyimages/34712143-2.jpg, http://www.clearancebeads.com/diyimages/34712143-3.jpg, http://www.clearancebeads.com/diyimages/34712143-4.jpg, http://www.clearancebeads.com/diyimages/34712143-5.jpg"
"2949415","900","These distinctive metal beads and charms add a degree of form and style to your designs. 26 pieces per package.","26pc 3mm Round Bead - Sterling Silver","Beads","","Silver","Base Metal","Metal Beads","Round",,"Silver","Silver, Copper","3mm","26","round, bead","","N",999999,"",4,7.99,137,"http://www.clearancebeads.com/diyimages/2949415.jpg, http://www.clearancebeads.com/diyimages/2949415-2.jpg, http://www.clearancebeads.com/diyimages/2949415-3.jpg, http://www.clearancebeads.com/diyimages/2949415-4.jpg, http://www.clearancebeads.com/diyimages/2949415-5.jpg"
"4949448","900","Use these 6mm platinum plate open jump rings to connect different elements of your design. A slight cut in the ring allows it to open and close easily. Our Elegance line provides you with the best quality starling silver beads and components for your finer artistic designs.","16pc 6mm Platinum Plate Jump Ring","Findings","","Silver","Platinum Plated","Jump Rings","",,"Silver","Copper, Platinum","6mm","16","findings; platinum plate; elegance; jump ring","","N",999999,"",2.5,0,334,"http://www.clearancebeads.com/diyimages/4949448.jpg, http://www.clearancebeads.com/diyimages/4949448-2.jpg, http://www.clearancebeads.com/diyimages/4949448-3.jpg, http://www.clearancebeads.com/diyimages/4949448-4.jpg, http://www.clearancebeads.com/diyimages/4949448-5.jpg"
"4949472","900","Use these  platinum eye pin to connect different elements of your design. Our Elegance line provides you with the best quality starling silver beads and components for your finer artistic designs.","10pc 35mm Platinum Plate Eye Pin","Findings","","Silver","Platinum Plated","Eye Pins","",,"Silver","Copper, Platinum","35mm","10","findings; platinum plate; elegance;  eye pin","","N",999999,"",2.5,0,310,"http://www.clearancebeads.com/diyimages/4949472.jpg, http://www.clearancebeads.com/diyimages/4949472-2.jpg, http://www.clearancebeads.com/diyimages/4949472-3.jpg, http://www.clearancebeads.com/diyimages/4949472-4.jpg, http://www.clearancebeads.com/diyimages/4949472-5.jpg"
"8950006","900","Give your bracelet, necklace and earring creations a secure and professional finish using these silver plate crimp beads. These finishing beads are ideal for attaching clasps to stringing wire, positioning beads on ""illusion""jewelry designs and securing multiple strands to jewelry findings.","50pc 2mm Sterling Silver Plate Crimp Bead","Findings","","Silver","Sterling Silver","Crimp Beads","",,"Silver","Copper, Silver","2mm","50","findings; sterling silver; crimp bead","","N",999999,"",1,0,2967,"http://www.clearancebeads.com/diyimages/8950006.jpg, http://www.clearancebeads.com/diyimages/8950006-2.jpg, http://www.clearancebeads.com/diyimages/8950006-3.jpg, http://www.clearancebeads.com/diyimages/8950006-4.jpg, http://www.clearancebeads.com/diyimages/8950006-5.jpg"
"63518509","900","Fluid glass, intricate metal and acrylic beads combined in elegant strands. Each strand of beads is a professionally coordinated mix designed to give foolproof fantastic jewelry results. Many strands feature unique mixes of exciting beads and custom designed metal beads with accents that bring you one step closer to a fashionable finished project. This package contains one 15in/38cm strand of variety of pink and purple beads.","120pc Acrylic Pink/Purple Drops Strand","Chains","Purple","Pink","Acrylic","Acrylic Beads","",,"Silver","","16in","120","strand, pink drops, beads","","N",999999,"",2.99,0,9738,"http://www.clearancebeads.com/diyimages/63518509.jpg, http://www.clearancebeads.com/diyimages/63518509-2.jpg, http://www.clearancebeads.com/diyimages/63518509-3.jpg, http://www.clearancebeads.com/diyimages/63518509-4.jpg, http://www.clearancebeads.com/diyimages/63518509-5.jpg"
"34734237","900","Fun Pack pompoms are great for any large project or group bead project. Entertain and add a dash of pompom to create unique projects that will put a smile on your little crafters faces.","Fun Pack Assortment Color Pompom","Kids","","Multi","Plastic","Acrylic Beads","Round",,"","","12-20mm","90","Fun Pack, pompoms, pom, pompom beads, kids crafts","","N",999999,"",2.5,4.99,614,"http://www.clearancebeads.com/diyimages/34734237.jpg, http://www.clearancebeads.com/diyimages/34734237-2.jpg, http://www.clearancebeads.com/diyimages/34734237-3.jpg, http://www.clearancebeads.com/diyimages/34734237-4.jpg, http://www.clearancebeads.com/diyimages/34734237-5.jpg"
"35021003","900","This Bead loom kit is great for making beaded bracelets and learning new weaving techniques. You can create your own pattern for infinite creativity. This will make a perfect gift!","Bead Loom","Tools","","Black","Stainless Steel","Misc Tools","",,"","Steel","12x2.5in","1","Bead Loom, Tools","","N",999999,"",2.5,4.99,6,"http://www.clearancebeads.com/diyimages/35021003.jpg, http://www.clearancebeads.com/diyimages/35021003-2.jpg, http://www.clearancebeads.com/diyimages/35021003-3.jpg, http://www.clearancebeads.com/diyimages/35021003-4.jpg, http://www.clearancebeads.com/diyimages/35021003-5.jpg"
"37600049","900","Personalize your favorite LaurDIY bracelet base or necklace with the LaurDIY Magical Cuties Charms. Each charm has a lobster clasp which makes it easy to attach to any LaurDIY bracelet or necklace.","LaurDIY Magical Cuties Charms","LaurDIY","","Multi","Base Metal","Charms","",,"Silver","Zinc, Iron, Brass","22mm","4","jewelry; cousindiy; cousin; youtuber; charms; charm pack; magical cuties; laurdiy; lauren riihimaki","","N",999999,"",4,7.99,654,"http://www.clearancebeads.com/diyimages/37600049.jpg, http://www.clearancebeads.com/diyimages/37600049-2.jpg, http://www.clearancebeads.com/diyimages/37600049-3.jpg, http://www.clearancebeads.com/diyimages/37600049-4.jpg, http://www.clearancebeads.com/diyimages/37600049-5.jpg"
"37600050","900","Personalize your favorite LaurDIY bracelet base or necklace with the LaurDIY Nom Nom Nom Charms. Each charm has a lobster clasp which makes it easy to attach to any LaurDIY bracelet or necklace.","LaurDIY Nom Nom Nom Charms","LaurDIY","","Multi","Plastic","Charms","Food",,"Silver","Brass, Iron, Zinc","20-24mm","4","jewelry; cousindiy; cousin; youtuber; charms; charm pack; nom; laurdiy; lauren riihimaki","","N",999999,"",4,7.99,879,"http://www.clearancebeads.com/diyimages/37600050.jpg, http://www.clearancebeads.com/diyimages/37600050-2.jpg, http://www.clearancebeads.com/diyimages/37600050-3.jpg, http://www.clearancebeads.com/diyimages/37600050-4.jpg, http://www.clearancebeads.com/diyimages/37600050-5.jpg"
"47731905","900","Add a dazzling accent to your jewelry with this butterfly connector. You can use 3mm flat back  Swarovski® Crystals to personalize it and make a really unique design that will really stand out.","1pc Metal Silver Butterfly Connector","Swarovski","","Silver","Base Metal","Connectors","Butterfly",,"Silver","Zinc","22x29mm","1","Connector, Butterfly, base","","N",999999,"",1.5,0,653,"http://www.clearancebeads.com/diyimages/47731905.jpg, http://www.clearancebeads.com/diyimages/47731905-2.jpg, http://www.clearancebeads.com/diyimages/47731905-3.jpg, http://www.clearancebeads.com/diyimages/47731905-4.jpg, http://www.clearancebeads.com/diyimages/47731905-5.jpg"
"47859152","900","These Peridot Shimmer Flatbacks are loose crystal elements backed with platinum foiling for extra brilliance and protection. They are easy to apply to a variety of carrier materials using standard one- or two-component glues. It also has the most progressive and unique cut in the market: multilayer cut technology, producing the inspiring XIRIUS star design.","35 3.8mm Peridot Shimmer Flatback","Swarovski","Peridot Shimmer","Green","Crystal","Flatbacks","2088 Xirius Rose",,"","","16ss / 3.8mm","35","Flatback, Swarovski, Peridot, Shimmer","","N",999999,"",3.5,0,257,"http://www.clearancebeads.com/diyimages/47859152.jpg, http://www.clearancebeads.com/diyimages/47859152-2.jpg, http://www.clearancebeads.com/diyimages/47859152-3.jpg, http://www.clearancebeads.com/diyimages/47859152-4.jpg, http://www.clearancebeads.com/diyimages/47859152-5.jpg"
"47860135","900","These beautiful rhinestones come in two colors: Light Colorado Topaz and Light Colorado Topaz Shimmer! These Flat Back Crystals are loose crystal elements backed with platinum foiling for extra brilliance and protection. They are easy to apply to a variety of carrier materials using standard one- or two-component glues. It also has the most progressive and unique cut in the market: multilayer cut technology, producing the inspiring XIRIUS star design.","80pc Swarovski Light Colorado Topaz/Light Colorado Topaz Shimmer Flatback Mix","Swarovski","Light Colorado Topaz, Light Colorado Topaz Shimmer","Multi","Crystal","Flatbacks","2088 Xirius Rose",,"","","16ss / 3.8mm","80","Flatback, Swarovski, Light Colorado Topaz, Shimmer, Mix","","N",999999,"",5,0,282,"http://www.clearancebeads.com/diyimages/47860135.jpg, http://www.clearancebeads.com/diyimages/47860135-2.jpg, http://www.clearancebeads.com/diyimages/47860135-3.jpg, http://www.clearancebeads.com/diyimages/47860135-4.jpg, http://www.clearancebeads.com/diyimages/47860135-5.jpg"
"34734103","900","Fun Pack pony beads are great for any large bead project or group bead projects. Entertain and add a dash of white pony beads to create unique projects that will put a smile on your little crafters faces.","Fun Pack White Pony Beads","Kids","","White","Acrylic","Pony Beads","Pony Bead",,"","","6x9mm","250","Fun Pack, kids beads, kids craft, white pony beads, round beads","","N",999999,"",1,1.99,1798,"http://www.clearancebeads.com/diyimages/34734103.jpg, http://www.clearancebeads.com/diyimages/34734103-2.jpg, http://www.clearancebeads.com/diyimages/34734103-3.jpg, http://www.clearancebeads.com/diyimages/34734103-4.jpg, http://www.clearancebeads.com/diyimages/34734103-5.jpg"
"34734123","900","Fun Pack pony beads are great for any large bead projects or group bead projects. Entertain and add a dash of green pony beads to create unique projects that will put a smile on your little crafters faces.","Fun Pack Green Pony Beads","Kids","","Green","Acrylic","Pony Beads","Pony Bead",,"","","6x9mm","250","Fun Pack, kids beads, kids craft, green pony beads, round beads","","N",999999,"",1,1.99,1981,"http://www.clearancebeads.com/diyimages/34734123.jpg, http://www.clearancebeads.com/diyimages/34734123-2.jpg, http://www.clearancebeads.com/diyimages/34734123-3.jpg, http://www.clearancebeads.com/diyimages/34734123-4.jpg, http://www.clearancebeads.com/diyimages/34734123-5.jpg"
"6123901","900","A must-have for jewelry makers, this necklace starter pack is perfect to make any kind of necklace. It is also a great item to start or replenish your personal jewelry findings collection.","119pc Necklace Silver Starter Pack","Findings","","Silver","Base Metal","Misc Tools","",,"Silver","Iron, Zinc, Copper","","119","findings; silver; starter pack","","N",999999,"",2,0,4779,"http://www.clearancebeads.com/diyimages/6123901.jpg, http://www.clearancebeads.com/diyimages/6123901-2.jpg, http://www.clearancebeads.com/diyimages/6123901-3.jpg, http://www.clearancebeads.com/diyimages/6123901-4.jpg, http://www.clearancebeads.com/diyimages/6123901-5.jpg"
"6124214","900","Ideal for all your jewelry making and beading projects, this all-in-one kit contains everything you need to create a beautiful  spiral necklace. This kit contains 500 pieces that are color-coordinated for stylish visual impact. Perfect gift for jewelry lovers!","All-in-one kit Spiral Necklace","Kits","","Green","Glass","Jewelry","",,"Silver","","","500","all-in-one, spiral, necklace, kit","","N",999999,"",2,0,212,"http://www.clearancebeads.com/diyimages/6124214.jpg, http://www.clearancebeads.com/diyimages/6124214-2.jpg, http://www.clearancebeads.com/diyimages/6124214-3.jpg, http://www.clearancebeads.com/diyimages/6124214-4.jpg, http://www.clearancebeads.com/diyimages/6124214-5.jpg"
"47517900","900","These Swarovski Black Rondelles offer the highest standard available on the market. The high-quality precision cutting and the clear through-hole achieve high brilliance and clarity. Rounded hole edges reduce the wear on thread and increase the durability of designs. They are available in the latest fashion colors, effects, and cuts. The main application techniques are beading, wiring, stringing, and weaving.","5pc 6mm Black Rondelle","Swarovski","","White","Crystal","Beads","4720/102",,"","","6mm","5","Swarovski, Rondelle, Beads, Black","","N",999999,"",3,0,1549,"http://www.clearancebeads.com/diyimages/47517900.jpg, http://www.clearancebeads.com/diyimages/47517900-2.jpg, http://www.clearancebeads.com/diyimages/47517900-3.jpg, http://www.clearancebeads.com/diyimages/47517900-4.jpg, http://www.clearancebeads.com/diyimages/47517900-5.jpg"
"47531251","900","These vitrail medium baroque Pendants have timeless elegance!  Pendants offer a whole range of design possibilities for different segments thanks to their easy application, with the top hole requiring only a jump ring/pinch bail with a chain or cord. Due to the diverse range of sizes available, Pendants are ideal for creating jewelry sets such as necklaces, bracelets, and earrings.","2pc Vitrail Medium Pendant Baroque","Swarovski","Crystal Vitrail Medium","Multi","Crystal","Pendants","6090 Baroque Pendant",,"","","16x11mm","2","Swarovski, Pendant-Baroque, Vitrail Medium","","N",999999,"",0,0,247,"http://www.clearancebeads.com/diyimages/47531251.jpg, http://www.clearancebeads.com/diyimages/47531251-2.jpg, http://www.clearancebeads.com/diyimages/47531251-3.jpg, http://www.clearancebeads.com/diyimages/47531251-4.jpg, http://www.clearancebeads.com/diyimages/47531251-5.jpg"
"24200","900","Bead Reamer is a fantastic tool to have when jewelry making. This bead reamer is great for smoothing out rough edges around bead holes and work great for everybody on all different types of jewelry.","Bead Reamer","Tools","","Blue","Steel","Misc Tools","",,"","Carbon Steel","6in","1","Blue Bead Reamer, Tools","","N",999999,"",2,3.99,2530,"http://www.clearancebeads.com/diyimages/24200.jpg, http://www.clearancebeads.com/diyimages/24200-2.jpg, http://www.clearancebeads.com/diyimages/24200-3.jpg, http://www.clearancebeads.com/diyimages/24200-4.jpg, http://www.clearancebeads.com/diyimages/24200-5.jpg"
"34708266","900","A vibrant collection of rondelle beads that will sparkle in your homemade jewelry creations.  Use this wonderful set of to accent alluring bracelets or necklaces with individual style!","8pc 4X8 Rondelle Silver with Crystal","Beads","","Silver","Base Metal","Metal Beads","Rondelle",,"Silver","Brass","4x8mm","8","rondelle, bead","","N",999999,"",2,3.99,6927,"http://www.clearancebeads.com/diyimages/34708266.jpg, http://www.clearancebeads.com/diyimages/34708266-2.jpg, http://www.clearancebeads.com/diyimages/34708266-3.jpg, http://www.clearancebeads.com/diyimages/34708266-4.jpg, http://www.clearancebeads.com/diyimages/34708266-5.jpg"
"37600066","900","Create your own stretch bracelets with this LaurDIY Black Gold Stretch Bracelet Mini DIY Kit. This kit features a gold skull and matte black beads. LaurDIY Mini Kits are perfect for gift-giving!","LaurDIY Black Gold Stretch Bracelet Mini DIY Kit","LaurDIY","","Black","Acrylic","Jewelry","",,"Gold","Zinc, Iron","","","jewelry; cousindiy; cousin; youtuber; diy; jewelry making; skull bracelet; laurdiy; lauren riihimaki","","N",999999,"",6.5,12.99,735,"http://www.clearancebeads.com/diyimages/37600066.jpg, http://www.clearancebeads.com/diyimages/37600066-2.jpg, http://www.clearancebeads.com/diyimages/37600066-3.jpg, http://www.clearancebeads.com/diyimages/37600066-4.jpg, http://www.clearancebeads.com/diyimages/37600066-5.jpg"
"37600074","900","Create your own wrap bracelet with this LaurDIY Gold Turquoise Wrap Bracelet Mini DIY Kit. LaurDIY Mini Kits are perfect for gift-giving!","LaurDIY Gold Turquoise Wrap Bracelet Mini DIY Kit","LaurDIY","","Turquoise","Suede","Jewelry","",,"Gold","Zinc","","","jewelry; cousindiy; cousin; youtuber; gold; turquoise; bracelet; laurdiy; lauren riihimaki","","N",999999,"",6.5,12.99,750,"http://www.clearancebeads.com/diyimages/37600074.jpg, http://www.clearancebeads.com/diyimages/37600074-2.jpg, http://www.clearancebeads.com/diyimages/37600074-3.jpg, http://www.clearancebeads.com/diyimages/37600074-4.jpg, http://www.clearancebeads.com/diyimages/37600074-5.jpg"
"63518750","900","These smoke, gray and black glass faceted charms add the perfect touch to your homemade jewelry creations.  Accentuate your custom necklaces and bracelets with this fashionable collection.","12pc Glass Smoke-Gray-Black Faceted Teardrop","Beads","","Multi","Glass","Glass Beads","Teardrop",,"","","","12","teardrop, glass, faceted","","N",999999,"",0,0,2599,"http://www.clearancebeads.com/diyimages/63518750.jpg, http://www.clearancebeads.com/diyimages/63518750-2.jpg, http://www.clearancebeads.com/diyimages/63518750-3.jpg, http://www.clearancebeads.com/diyimages/63518750-4.jpg, http://www.clearancebeads.com/diyimages/63518750-5.jpg"
"31694002","900","Our bracelet Kit is the easiest way to create a beautiful piece of personalized jewelry for Christmas. This bracelet kit contains 16 pieces that are color-coordinated for stylish visual impact. With the variety of pieces available in this jewelry making kit, and various options available, any bracelet you make will be funky and eye-catching. Combine these bracelet accents in any order to create an attractive accessory that suits your own style.","16pc Christmas Bracelet kit","Kits","","Multi","Glass","Jewelry","",,"Antique Silver","","","16","bracelet, kit, large hole bead, Christmas","","N",999999,"",5,0,0,"http://www.clearancebeads.com/diyimages/31694002.jpg, http://www.clearancebeads.com/diyimages/31694002-2.jpg, http://www.clearancebeads.com/diyimages/31694002-3.jpg, http://www.clearancebeads.com/diyimages/31694002-4.jpg, http://www.clearancebeads.com/diyimages/31694002-5.jpg"
"34708272","900","A vibrant collection of rondelle beads that will sparkle in your homemade jewelry creations.  Use this wonderful set of to accent alluring bracelets or necklaces with individual style!","8pc 4X8 Rondelle Silver and Black","Beads","","Silver","Base Metal","Metal Beads","Rondelle",,"Silver","Brass","3x7mm","8","rondelle, bead","","N",999999,"",2,3.99,2094,"http://www.clearancebeads.com/diyimages/34708272.jpg, http://www.clearancebeads.com/diyimages/34708272-2.jpg, http://www.clearancebeads.com/diyimages/34708272-3.jpg, http://www.clearancebeads.com/diyimages/34708272-4.jpg, http://www.clearancebeads.com/diyimages/34708272-5.jpg"
"34719080","900","Use these gunmetal eye/head pins to connect different elements of your design. Express your creativity by making your own beautiful custom jewelry.","135pc Gunmetal Head/Eye Pin Pack","Findings","","Grey","Base Metal","Misc Tools","",,"Grey","Iron","2in","135","findings; gunmetal; eye pin","","N",999999,"",2,3.99,98,"http://www.clearancebeads.com/diyimages/34719080.jpg, http://www.clearancebeads.com/diyimages/34719080-2.jpg, http://www.clearancebeads.com/diyimages/34719080-3.jpg, http://www.clearancebeads.com/diyimages/34719080-4.jpg, http://www.clearancebeads.com/diyimages/34719080-5.jpg"
"34708681","900","Do it yourself! You'll love the boho style found in this kit. You can make a beautiful tassel necklace in less than 20 minutes. Simply follow the instructions included in this kit to create a great addition to your jewelry collection.","Do it Yourself! Boho Necklace Kit","Kits","","Silver","Base Metal","Jewelry","",,"Silver","Iron, Zinc","","14","do it yourself, kit, boho necklace","","N",999999,"",2.495,0,413,"http://www.clearancebeads.com/diyimages/34708681.jpg, http://www.clearancebeads.com/diyimages/34708681-2.jpg, http://www.clearancebeads.com/diyimages/34708681-3.jpg, http://www.clearancebeads.com/diyimages/34708681-4.jpg, http://www.clearancebeads.com/diyimages/34708681-5.jpg"
"34734729","900","Fun Pack of heart cube beads are great for any large bead projects or group bead projects. Entertain and add a dash of fun to create unique projects that will put a smile on your little crafters faces.","Fun Pack Acrylic Heart Cube Beads","Kids","","Multi","Acrylic","Acrylic Beads","Square",,"","","7mm","50","Fun Pack, Valentines Day, hearts bead, heart, square beads, acrylic beads, kids craft","","N",999999,"",2,3.99,146,"http://www.clearancebeads.com/diyimages/34734729.jpg, http://www.clearancebeads.com/diyimages/34734729-2.jpg, http://www.clearancebeads.com/diyimages/34734729-3.jpg, http://www.clearancebeads.com/diyimages/34734729-4.jpg, http://www.clearancebeads.com/diyimages/34734729-5.jpg"
"34708664","900","Do it yourself! You'll love the dreamy blue style found in this kit. You can make a double layer necklace in less than 30 minutes. Simply follow the instructions included in this jewelry kit to create a great addition to your jewelry collection.","Do it Yourself! Dreamy Necklace Kit","Kits","","blue","Base Metal","Jewelry","",,"Silver","Iron, Zinc","","13","do it yourself, kit, dreamy","","N",999999,"",2.495,0,316,"http://www.clearancebeads.com/diyimages/34708664.jpg, http://www.clearancebeads.com/diyimages/34708664-2.jpg, http://www.clearancebeads.com/diyimages/34708664-3.jpg, http://www.clearancebeads.com/diyimages/34708664-4.jpg, http://www.clearancebeads.com/diyimages/34708664-5.jpg"
"34734518","900","Fun Pack butterfly bracelet kit will inspire kids of all ages. Entertain and amuse your little crafters with this fun DIY accessory that will put a smile on their faces.","Fun Pack Butterfly Bracelet Kit","Kids","","Multi","Acrylic","Jewelry","Butterfly",,"","","","85","","","N",999999,"",1.5,0,1076,"http://www.clearancebeads.com/diyimages/34734518.jpg, http://www.clearancebeads.com/diyimages/34734518-2.jpg, http://www.clearancebeads.com/diyimages/34734518-3.jpg, http://www.clearancebeads.com/diyimages/34734518-4.jpg, http://www.clearancebeads.com/diyimages/34734518-5.jpg"
"2949423","900","These silver plated head pins will assist you in creating your homemade earrings, bracelets, and necklaces! Our Elegance line provides you with the best quality starling silver beads and components for your finer artistic designs. These ball head pins have a Hallmark .925.","12pc 25mm Sterling Silver Ball Head Pin","Findings","","Silver","Sterling Silver","Head Pins","",,"Silver","Silver, Copper","25mm","12","findings; sterling silver; elegance; head pin","","N",999999,"",3,5.99,157,"http://www.clearancebeads.com/diyimages/2949423.jpg, http://www.clearancebeads.com/diyimages/2949423-2.jpg, http://www.clearancebeads.com/diyimages/2949423-3.jpg, http://www.clearancebeads.com/diyimages/2949423-4.jpg, http://www.clearancebeads.com/diyimages/2949423-5.jpg"
"34708573","900","Utilize your crafty, creative imagination to make a beautiful necklace with these silver and black charms! The silver will instantly make your jewelry projects stand out. Also, These charms make are an excellent way to thoughtfully personalize gifts.","3pc Metal Charm Silver/Black with Confetti","Charms & Pendants","","Silver","Base Metal","Charms","Round",,"Antique Silver","Zinc","23x19mm","3","charms, metal charms","","N",999999,"",2,3.99,3482,"http://www.clearancebeads.com/diyimages/34708573.jpg, http://www.clearancebeads.com/diyimages/34708573-2.jpg, http://www.clearancebeads.com/diyimages/34708573-3.jpg, http://www.clearancebeads.com/diyimages/34708573-4.jpg, http://www.clearancebeads.com/diyimages/34708573-5.jpg"
"37600071","900","Create your own stretch bracelets with this LaurDIY Pink Blue Peace Stretch Bracelet Mini DIY Kit. LaurDIY Mini Kits are perfect for gift-giving!","LaurDIY Pink Blue Peace Stretch Bracelet Mini DIY Kit","LaurDIY","","Pink","Glass","Jewelry","",,"Silver","Zinc, Iron","","","jewelry; cousindiy; cousin; youtuber; pink; blue; peace; bracelet; laurdiy; lauren riihimaki","","N",999999,"",6.5,12.99,668,"http://www.clearancebeads.com/diyimages/37600071.jpg, http://www.clearancebeads.com/diyimages/37600071-2.jpg, http://www.clearancebeads.com/diyimages/37600071-3.jpg, http://www.clearancebeads.com/diyimages/37600071-4.jpg, http://www.clearancebeads.com/diyimages/37600071-5.jpg"
