"vItemNumber","vLocation","vDescription","vShortDesc","vLook","vSpecificColor","vGenColor","vGenMaterial","vGenItemType","vShape","vSizeType","vMetalColor","vMetalType","vDimensions","vPcCounts","vKeywords","vOnSale","vFeaturedItem","vSorting","vAggregation","itemprice_1","itemprice_2","quantityonhand","imagefilename"
"63517913","900","Why not try using this silver hammered cuff to make your very own bracelet! Mix and match it with a variety of connectors and add special charms to create a different look for every day of the week!","1pc Metal Silver Hammered cuff","Finished Jewelry","","Silver","Base Metal","Bracelets","",,"Silver","Iron","2.75in","1","","","N",999999,"",0,0,0,"http://www.clearancebeads.com/diyimages/63517913.jpg, http://www.clearancebeads.com/diyimages/63517913-2.jpg, http://www.clearancebeads.com/diyimages/63517913-3.jpg, http://www.clearancebeads.com/diyimages/63517913-4.jpg, http://www.clearancebeads.com/diyimages/63517913-5.jpg"
"6121421","900","These 24.5in black bead strand offer a reflective outer layer sure to create show-stopping looks! Each bead features multiple facets that reflect light, creating a gleaming, dazzling effect.","24.5/62cm Black Glass Tube Bead","Beads","","Black","Glass","Glass Beads","Tube",,"","","4-12mm","","tube bead, black","","N",999999,"",2,0,2988,"http://www.clearancebeads.com/diyimages/6121421.jpg, http://www.clearancebeads.com/diyimages/6121421-2.jpg, http://www.clearancebeads.com/diyimages/6121421-3.jpg, http://www.clearancebeads.com/diyimages/6121421-4.jpg, http://www.clearancebeads.com/diyimages/6121421-5.jpg"
"47690105","900","These 3mm Blue Zircon rhinestones are loose crystal elements with a flat reverse side that has been pre-coated with a heat-sensitive glue. These Flat Backs can be easily applied to a large range of textile carrier materials using heat to produce a durable and long-lasting crystal effect. It has the most progressive and unique cut in the market: multilayer cut technology, producing the inspiring XIRIUS star design.","38pc 3mm  Blue Zircon Hotfix","Swarovski","Blue Zircon","Blue","Crystal","Hotfixes","2078 Xirius Rose",,"","","12ss / 3mm","38","Hotfix, Swarovski, Blue Zircon","","N",999999,"",3,0,83,"http://www.clearancebeads.com/diyimages/47690105.jpg, http://www.clearancebeads.com/diyimages/47690105-2.jpg, http://www.clearancebeads.com/diyimages/47690105-3.jpg, http://www.clearancebeads.com/diyimages/47690105-4.jpg, http://www.clearancebeads.com/diyimages/47690105-5.jpg"
"WC81212047","900","A must-have for jewelry makers, this bright gold jewelry findings assortment is perfect for make earrings, necklaces, bracelets and more. It is also a great item to start or replenish your personal jewelry findings collection.","125pc Metal Bright Gold Findings Assortment","Findings","","Gold","Base Metal","Misc Tools","",,"Gold","Zinc, Iron, Copper","","125","findings; bright gold; assortment","","N",999999,"",0,0,1108,"http://www.clearancebeads.com/diyimages/WC81212047.jpg, http://www.clearancebeads.com/diyimages/WC81212047-2.jpg, http://www.clearancebeads.com/diyimages/WC81212047-3.jpg, http://www.clearancebeads.com/diyimages/WC81212047-4.jpg, http://www.clearancebeads.com/diyimages/WC81212047-5.jpg"
"39910099","900","This great heart keys charm with crystals from Swarovski® is the ideal collectible piece. Use them to create a look that is unique to you and mark life’s unforgettable moments. Great for adding a dazzling accent to jewelry, keys and more","Swarovski Heart/Keys Charm","Swarovski","Indian Siam, Siam","Red","Base Metal","Charms","Heart",,"Silver","Brass, Iron","39x12mm","1","charms, swarovski crystal, heart charm, key charm","","N",999999,"",0,0,98,"http://www.clearancebeads.com/diyimages/39910099.jpg, http://www.clearancebeads.com/diyimages/39910099-2.jpg, http://www.clearancebeads.com/diyimages/39910099-3.jpg, http://www.clearancebeads.com/diyimages/39910099-4.jpg, http://www.clearancebeads.com/diyimages/39910099-5.jpg"
"47693556","900","These Cool Blues rhinestones are loose crystal elements with a flat reverse side that has been pre-coated with a heat-sensitive glue. These Flat Backs can be easily applied to a large range of textile carrier materials using heat to produce a durable and long-lasting crystal effect. It has the most progressive and unique cut in the market: multilayer cut technology, producing the inspiring XIRIUS star design.","80pc Swarovski Cool Blues Hotfix Mix","Swarovski","Mix Cool Blues","Blue","Crystal","Hotfixes","2078 Xirius Rose",,"","","12ss / 3mm, 16ss / 3.8mm, 20ss / 4.6mm","80","Hotfix, Swarovski, Cool Blues, Mix","","N",999999,"",5,0,431,"http://www.clearancebeads.com/diyimages/47693556.jpg, http://www.clearancebeads.com/diyimages/47693556-2.jpg, http://www.clearancebeads.com/diyimages/47693556-3.jpg, http://www.clearancebeads.com/diyimages/47693556-4.jpg, http://www.clearancebeads.com/diyimages/47693556-5.jpg"
"47691397","900","These 4mm Crystal Shimmer rhinestones are loose crystal elements with a flat reverse side that has been pre-coated with a heat-sensitive glue. These Flat Backs can be easily applied to a large range of textile carrier materials using heat to produce a durable and long-lasting crystal effect. It has the most progressive and unique cut in the market: multilayer cut technology, producing the inspiring XIRIUS star design.","30 3.8mm Crystal Shimmer Hotfix","Swarovski","Crystal Shimmer","Clear/Crystal","Crystal","Hotfixes","2078 Xirius Rose",,"","","16ss / 3.8mm","30","Hotfix, Swarovski, Crystal, Shimmer","","N",999999,"",0,0,105,"http://www.clearancebeads.com/diyimages/47691397.jpg, http://www.clearancebeads.com/diyimages/47691397-2.jpg, http://www.clearancebeads.com/diyimages/47691397-3.jpg, http://www.clearancebeads.com/diyimages/47691397-4.jpg, http://www.clearancebeads.com/diyimages/47691397-5.jpg"
"47691406","900","These 4mm Peridot Shimmer rhinestones are loose crystal elements with a flat reverse side that has been pre-coated with a heat-sensitive glue. These Flat Backs can be easily applied to a large range of textile carrier materials using heat to produce a durable and long-lasting crystal effect. It has the most progressive and unique cut in the market: multilayer cut technology, producing the inspiring XIRIUS star design.","30 3.8mm Peridot Shimmer Hotfix","Swarovski","Peridot Shimmer","Blue","Crystal","Hotfixes","2078 Xirius Rose",,"","","16ss / 3.8mm","30","Hotfix, Swarovski, Peridot, Shimmer","","N",999999,"",0,0,170,"http://www.clearancebeads.com/diyimages/47691406.jpg, http://www.clearancebeads.com/diyimages/47691406-2.jpg, http://www.clearancebeads.com/diyimages/47691406-3.jpg, http://www.clearancebeads.com/diyimages/47691406-4.jpg, http://www.clearancebeads.com/diyimages/47691406-5.jpg"
"4454","900","These Needle nose pliers are Great for wire wrapping, beading and jewelry repair.  It features a Stainless steel body with soft grip cushion handles for added comfort and more secure grip. The flattened, slightly serrated jaws are perfect for fine grip. It also has a Side cutter for accurate cuts on soft wires, plastics, and other light materials.","Needle Nose Plier With Cutter","Tools","","Blue","Steel","Pliers & Cutters","",,"","Carbon Steel","5x2in","1","Needle Nose Pliers, Wire cutter, tools","","N",999999,"",2,3.99,1261,"http://www.clearancebeads.com/diyimages/4454.jpg, http://www.clearancebeads.com/diyimages/4454-2.jpg, http://www.clearancebeads.com/diyimages/4454-3.jpg, http://www.clearancebeads.com/diyimages/4454-4.jpg, http://www.clearancebeads.com/diyimages/4454-5.jpg"
"34713015","900","Jewelry Basics is an exquisite collection of classic beads that will sparkle in your homemade jewelry creations. Fashion these timeless; aqua glass beads; into an alluring bracelet or necklace with individual style!","75pc 8mm Round Crackle Aqua","Beads","","Blue","Glass","Glass Beads","Round",,"","","8mm","75","round, bead","","N",999999,"",2,0,1191,"http://www.clearancebeads.com/diyimages/34713015.jpg, http://www.clearancebeads.com/diyimages/34713015-2.jpg, http://www.clearancebeads.com/diyimages/34713015-3.jpg, http://www.clearancebeads.com/diyimages/34713015-4.jpg, http://www.clearancebeads.com/diyimages/34713015-5.jpg"
"47692107","900","These Dark Moss Green Flatbacks are loose crystal elements backed with platinum foiling for extra brilliance and protection. They are easy to apply to a variety of carrier materials using standard one- or two-component glues. It also has the most progressive and unique cut in the market: multilayer cut technology, producing the inspiring XIRIUS star design.","20 4.6mm Dark Moss Green Flatback","Swarovski","Dark Moss Green","Blue","Crystal","Flatbacks","2078 Xirius Rose",,"","","20ss / 4.6mm","20","Flatback, Swarovski, Dark Moss Green","","N",999999,"",2.5,0,682,"http://www.clearancebeads.com/diyimages/47692107.jpg, http://www.clearancebeads.com/diyimages/47692107-2.jpg, http://www.clearancebeads.com/diyimages/47692107-3.jpg, http://www.clearancebeads.com/diyimages/47692107-4.jpg, http://www.clearancebeads.com/diyimages/47692107-5.jpg"
"47692168","900","These 5mm Sunflower rhinestones are loose crystal elements with a flat reverse side that has been pre-coated with a heat-sensitive glue. These Flat Backs can be easily applied to a large range of textile carrier materials using heat to produce a durable and long-lasting crystal effect. It has the most progressive and unique cut in the market: multilayer cut technology, producing the inspiring XIRIUS star design.","20 4.6mm Sunflower Hotfix","Swarovski","Sunflower","Yellow","Crystal","Hotfixes","2078 Xirius Rose",,"","","20ss / 4.6mm","20","Hotfix, Swarovski, Sunflower","","N",999999,"",3,0,368,"http://www.clearancebeads.com/diyimages/47692168.jpg, http://www.clearancebeads.com/diyimages/47692168-2.jpg, http://www.clearancebeads.com/diyimages/47692168-3.jpg, http://www.clearancebeads.com/diyimages/47692168-4.jpg, http://www.clearancebeads.com/diyimages/47692168-5.jpg"
"63716002","900","With our Bicone Beads, you can create beautiful pieces of jewelry that everyone will love. Whether you are designing necklaces; bracelets; earrings or more. These beads will make your creations stand out among the rest! This 42 piece package includes 4mm black bicone.","42pc 4mm Black Bicone","Beads","","Black","Glass","Glass Beads","Bicone",,"","","4mm","42","bicone, black","","N",999999,"",0.5,0,0,"http://www.clearancebeads.com/diyimages/63716002.jpg, http://www.clearancebeads.com/diyimages/63716002-2.jpg, http://www.clearancebeads.com/diyimages/63716002-3.jpg, http://www.clearancebeads.com/diyimages/63716002-4.jpg, http://www.clearancebeads.com/diyimages/63716002-5.jpg"
"47866650","900","With this 120pc Blue Combo, you can experience the sparkle of Swarovski® Crystals on your nails with a sparkling manicure. Swarovski crystals are at the forefront of the crystalized nail super-trend, turning nails into a canvas for self-expression, as well as a stylish accessory both on and off the catwalk.","120pc Blue Swarovski Nail Combo","Swarovski","Aquamarine, Sapphire","Blue","Crystal","Flatbacks","2058 Xilion Rose",,"","","5ss / 1.7mm, 7ss / 2.1mm, 9ss / 2.5mm","120","Swarovski, Nail, Blue","","N",999999,"",5,0,325,"http://www.clearancebeads.com/diyimages/47866650.jpg, http://www.clearancebeads.com/diyimages/47866650-2.jpg, http://www.clearancebeads.com/diyimages/47866650-3.jpg, http://www.clearancebeads.com/diyimages/47866650-4.jpg, http://www.clearancebeads.com/diyimages/47866650-5.jpg"
"47736905","900","This 3pc Hope, Love and Faith metal charm set with crystals from Swarovski® is the ideal collectible piece. Use them to create a look that is unique to you and mark life’s unforgettable moments.","3pc Hope, Love and Faith Metal Silver Accents","Swarovski","","Silver","Base Metal","Pendants","Circle",,"Silver","Zinc","18x18mm","3","Hope, Love, Faith,  accents","","N",999999,"",1,0,592,"http://www.clearancebeads.com/diyimages/47736905.jpg, http://www.clearancebeads.com/diyimages/47736905-2.jpg, http://www.clearancebeads.com/diyimages/47736905-3.jpg, http://www.clearancebeads.com/diyimages/47736905-4.jpg, http://www.clearancebeads.com/diyimages/47736905-5.jpg"
"47742001","900","Create your style with this 18in Necklace base. You can use 4mm and 6mm flat back Swarovski® Crystals to make a really unique design that will really stand out.","Swarvoski 18in Vertical Bar Necklace Base","Swarovski","","Silver","Base Metal","Jewelry","",,"Silver","Zinc","37x7mm","1","Swarovski, Base, Necklace","","N",999999,"",3.995,7.99,328,"http://www.clearancebeads.com/diyimages/47742001.jpg, http://www.clearancebeads.com/diyimages/47742001-2.jpg, http://www.clearancebeads.com/diyimages/47742001-3.jpg, http://www.clearancebeads.com/diyimages/47742001-4.jpg, http://www.clearancebeads.com/diyimages/47742001-5.jpg"
"63517903","900","You can use this gold loop bangle to make your very own bracelet! You can use add in some beads and why not try wire wrapping to create a great design.","1pc 7in Metal Gold Loop Bangle","Finished Jewelry","","Gold","Base Metal","Bracelets","",,"Gold","Iron","2.5in","1","","","N",999999,"",0,0,0,"http://www.clearancebeads.com/diyimages/63517903.jpg, http://www.clearancebeads.com/diyimages/63517903-2.jpg, http://www.clearancebeads.com/diyimages/63517903-3.jpg, http://www.clearancebeads.com/diyimages/63517903-4.jpg, http://www.clearancebeads.com/diyimages/63517903-5.jpg"
"63518012","900","Create and wear your very own rope jewelry! You can make rope earrings and bracelet in less than 30 minutes. The kit also includes step-by-step instructions in which you can learn a knotting technique.  Perfect gift for jewelry lovers!","Designs by me - Rope Jewelry Kit","Kits","","Orange","Cotton","Jewelry","",,"Silver","","","7","kit, designs by me, rope jewelry","","N",999999,"",2.99,0,6598,"http://www.clearancebeads.com/diyimages/63518012.jpg, http://www.clearancebeads.com/diyimages/63518012-2.jpg, http://www.clearancebeads.com/diyimages/63518012-3.jpg, http://www.clearancebeads.com/diyimages/63518012-4.jpg, http://www.clearancebeads.com/diyimages/63518012-5.jpg"
"29494542","900","Use this Curb Chain Necklace to create a delicate handmade jewelry design. Our Elegance line provides you with the best quality sterling silver beads and components for your finer artistic designs. Attach any pendant to the center of the necklace using a jump ring to create a stunning yet simple design. This chain has a Hallmark .925 on the clasp and the chain.","18in/45cm Elegance Curb Chain Necklace","Elegance","","Silver","Sterling Silver","Chain","",,"Silver","Silver, Copper","18in, 1.7mm","1","Curb Chain, Silver, Elegance","","N",999999,"",5.25,10.5,355,"http://www.clearancebeads.com/diyimages/29494542.jpg, http://www.clearancebeads.com/diyimages/29494542-2.jpg, http://www.clearancebeads.com/diyimages/29494542-3.jpg, http://www.clearancebeads.com/diyimages/29494542-4.jpg, http://www.clearancebeads.com/diyimages/29494542-5.jpg"
"2949742","900","Use these 14K Gold Plate closed jump rings to connect different elements of your design. Our Elegance line provides you with the best quality starling silver beads and components for your finer artistic designs.","16pc 6mm 14K Gold Plate Closed Ring","Findings","","Gold","Gold Plated","Jump Rings","",,"Gold","Copper, Gold","6mm","16","findings; gold plate; elegance; closed jump ring","","N",999999,"",2.5,4.99,339,"http://www.clearancebeads.com/diyimages/2949742.jpg, http://www.clearancebeads.com/diyimages/2949742-2.jpg, http://www.clearancebeads.com/diyimages/2949742-3.jpg, http://www.clearancebeads.com/diyimages/2949742-4.jpg, http://www.clearancebeads.com/diyimages/2949742-5.jpg"
"39910096","900","This Hamsa hand charm with crystals from Swarovski® is the ideal collectible piece. Use them to create a look that is unique to you and mark life’s unforgettable moments. Great for adding a dazzling accent to jewelry, keys and more!","Swarovski Hamsa Hand Charm","Swarovski","Crystal Scarabaeus Green, Fuchsia Shimmer","Purple","Base Metal","Charms","Hamsa",,"Silver","Brass, Iron","39x23mm","1","charms, swarovski crystal, hamsa hand","","N",999999,"",0,0,136,"http://www.clearancebeads.com/diyimages/39910096.jpg, http://www.clearancebeads.com/diyimages/39910096-2.jpg, http://www.clearancebeads.com/diyimages/39910096-3.jpg, http://www.clearancebeads.com/diyimages/39910096-4.jpg, http://www.clearancebeads.com/diyimages/39910096-5.jpg"
"39910170","900","These April Birthstone charms with crystals from Swarovski® are the ideal collectible pieces. Use them to create a look that is unique to you and mark life’s unforgettable moments.","April Birthstone Charms","Swarovski","Crystal","White","Base Metal","Charms","Round",,"Silver","Brass, Iron","27x13mm, 19x5mm","2","Swarovski, April, birthstone, charms","","N",999999,"",3.99,0,328,"http://www.clearancebeads.com/diyimages/39910170.jpg, http://www.clearancebeads.com/diyimages/39910170-2.jpg, http://www.clearancebeads.com/diyimages/39910170-3.jpg, http://www.clearancebeads.com/diyimages/39910170-4.jpg, http://www.clearancebeads.com/diyimages/39910170-5.jpg"
"47860140","900","These beautiful rhinestones come in two colors: Light Sapphire and Light Sapphire Shimmer! These Flat Back Crystals are loose crystal elements backed with platinum foiling for extra brilliance and protection. They are easy to apply to a variety of carrier materials using standard one- or two-component glues. It also has the most progressive and unique cut in the market: multilayer cut technology, producing the inspiring XIRIUS star design.","80pc Swarovski Light Sapphir/Light Sapphir Shimmer Flatback Mix","Swarovski","Light Sapphire, Light Sapphire Shimmer","Blue","Crystal","Flatbacks","2088 Xirius Rose",,"","","16ss / 3.8mm","80","Flatback, Swarovski, Light Sapphir, Shimmer, Mix","","N",999999,"",5,0,312,"http://www.clearancebeads.com/diyimages/47860140.jpg, http://www.clearancebeads.com/diyimages/47860140-2.jpg, http://www.clearancebeads.com/diyimages/47860140-3.jpg, http://www.clearancebeads.com/diyimages/47860140-4.jpg, http://www.clearancebeads.com/diyimages/47860140-5.jpg"
"39910109","900","This cute dolphin charm with crystals from Swarovski® is the ideal collectible piece. Use them to create a look that is unique to you and mark life’s unforgettable moments. Great for adding a dazzling accent to jewelry, keys and more","Swarovski Dolphin Charm","Swarovski","Black Diamond, Crystal, Sapphire","Blue","Base Metal","Charms","Dolphin",,"Silver","Brass, Iron","37x18mm","1","charms, swarovski crystal, dolphin","","N",999999,"",0,0,148,"http://www.clearancebeads.com/diyimages/39910109.jpg, http://www.clearancebeads.com/diyimages/39910109-2.jpg, http://www.clearancebeads.com/diyimages/39910109-3.jpg, http://www.clearancebeads.com/diyimages/39910109-4.jpg, http://www.clearancebeads.com/diyimages/39910109-5.jpg"
"39910115","900","This cute cupcake charm with crystals from Swarovski® is the ideal collectible piece. Use them to create a look that is unique to you and mark life’s unforgettable moments. Great for adding a dazzling accent to jewelry, keys and more","Swarovski Cupcake Charm","Swarovski","Blue Zircon, Crystal Aurore Boreale, Light Siam, L","Multi","Base Metal","Charms","Cupcake",,"Silver","Brass, Iron","31x19mm","1","charms, swarovski crystal, flower deco , cupcake","","N",999999,"",0,0,390,"http://www.clearancebeads.com/diyimages/39910115.jpg, http://www.clearancebeads.com/diyimages/39910115-2.jpg, http://www.clearancebeads.com/diyimages/39910115-3.jpg, http://www.clearancebeads.com/diyimages/39910115-4.jpg, http://www.clearancebeads.com/diyimages/39910115-5.jpg"
"47866649","900","With this 105pc Pink Combo, you can experience the sparkle of Swarovski® Crystals on your nails with a sparkling manicure. Swarovski crystals are at the forefront of the crystalized nail super-trend, turning nails into a canvas for self-expression, as well as a stylish accessory both on and off the catwalk.","105pc Pink Swarovski Nail Combo","Swarovski","Light Rose, Rose Aurore Boreale","Pink","Crystal","Flatbacks","2058 Xilion Rose",,"","","5ss / 1.7mm, 7ss / 2.1mm, 9ss / 2.5mm","105","Swarovski, Nail, Pink","","N",999999,"",5,0,29,"http://www.clearancebeads.com/diyimages/47866649.jpg, http://www.clearancebeads.com/diyimages/47866649-2.jpg, http://www.clearancebeads.com/diyimages/47866649-3.jpg, http://www.clearancebeads.com/diyimages/47866649-4.jpg, http://www.clearancebeads.com/diyimages/47866649-5.jpg"
"47869410","900","This  crystal storage box is perfect tool to store your Swarovski® Crystals. Easy to clearly see and organize your storage contents, find your items fast.","Crystal Storage Box","Swarovski","","Clear/Crystal","Plastic","Storage","",,"","","5x3.8in","1","Swarovski, Storage","","N",999999,"",2,3.99,1000,"http://www.clearancebeads.com/diyimages/47869410.jpg, http://www.clearancebeads.com/diyimages/47869410-2.jpg, http://www.clearancebeads.com/diyimages/47869410-3.jpg, http://www.clearancebeads.com/diyimages/47869410-4.jpg, http://www.clearancebeads.com/diyimages/47869410-5.jpg"
"47870401","900","This light sapphire shimmer pear pendant has timeless elegance!  Pendants offer a whole range of design possibilities for different segments thanks to their easy application, with the top hole requiring only a jump ring/pinch bail with a chain or cord. Due to the diverse range of sizes available, Pendants are ideal for creating jewelry sets such as necklaces, bracelets, and earrings.","1pc 22mm Light Sapphire Shimmer Pear Pendant","Swarovski","Lt. Sapph. Shimmer","Blue","Crystal","Pendants","6106 Pear-Shaped Pendant",,"","","22mm","1","Swarovski, Pendant, Pear","","N",999999,"",0,0,297,"http://www.clearancebeads.com/diyimages/47870401.jpg, http://www.clearancebeads.com/diyimages/47870401-2.jpg, http://www.clearancebeads.com/diyimages/47870401-3.jpg, http://www.clearancebeads.com/diyimages/47870401-4.jpg, http://www.clearancebeads.com/diyimages/47870401-5.jpg"
"47692102","900","These 5mm Aquamarine rhinestones are loose crystal elements with a flat reverse side that has been pre-coated with a heat-sensitive glue. These Flat Backs can be easily applied to a large range of textile carrier materials using heat to produce a durable and long-lasting crystal effect. It has the most progressive and unique cut in the market: multilayer cut technology, producing the inspiring XIRIUS star design.","20pc 5mm Aquamarine Hotfix","Swarovski","Aquamarine","Blue","Crystal","Hotfixes","2078 Xirius Rose",,"","","20ss / 4.6mm","20","Hotfix, Swarovski, Aquamarine","","N",999999,"",3,0,200,"http://www.clearancebeads.com/diyimages/47692102.jpg, http://www.clearancebeads.com/diyimages/47692102-2.jpg, http://www.clearancebeads.com/diyimages/47692102-3.jpg, http://www.clearancebeads.com/diyimages/47692102-4.jpg, http://www.clearancebeads.com/diyimages/47692102-5.jpg"
"47692130","900","These 5mm Jet rhinestones are loose crystal elements with a flat reverse side that has been pre-coated with a heat-sensitive glue. These Flat Backs can be easily applied to a large range of textile carrier materials using heat to produce a durable and long-lasting crystal effect. It has the most progressive and unique cut in the market: multilayer cut technology, producing the inspiring XIRIUS star design.","20pc 5mm Jet Hotfix","Swarovski","Jet","Black","Crystal","Hotfixes","2078 Xirius Rose",,"","","20ss / 4.6mm","20","Hotfix, Swarovski, Jet","","N",999999,"",3,0,48,"http://www.clearancebeads.com/diyimages/47692130.jpg, http://www.clearancebeads.com/diyimages/47692130-2.jpg, http://www.clearancebeads.com/diyimages/47692130-3.jpg, http://www.clearancebeads.com/diyimages/47692130-4.jpg, http://www.clearancebeads.com/diyimages/47692130-5.jpg"
"47692221","900","These 5mm Meridian Blue rhinestones are loose crystal elements with a flat reverse side that has been pre-coated with a heat-sensitive glue. These Flat Backs can be easily applied to a large range of textile carrier materials using heat to produce a durable and long-lasting crystal effect. It has the most progressive and unique cut in the market: multilayer cut technology, producing the inspiring XIRIUS star design.","18pc 5mm Meridian Blue Hotfix","Swarovski","Meridian Blue","Blue","Crystal","Hotfixes","2078 Xirius Rose",,"","","20ss / 4.6mm","18","Hotfix, Swarovski, Meridian Blue","","N",999999,"",2.5,0,818,"http://www.clearancebeads.com/diyimages/47692221.jpg, http://www.clearancebeads.com/diyimages/47692221-2.jpg, http://www.clearancebeads.com/diyimages/47692221-3.jpg, http://www.clearancebeads.com/diyimages/47692221-4.jpg, http://www.clearancebeads.com/diyimages/47692221-5.jpg"
"34741007","900","Mirror beads offer a reflective outer layer sure to create show-stopping looks!  Each bead features multiple facets that reflect light; creating a gleaming; dazzling effect.","20pc 10mm Round Mirror Beads - Champagne","Beads","","Cream/Off-White","Glass","Glass Beads","Round",,"","","10mm","20","mirror beads, round","","N",999999,"",2,0,0,"http://www.clearancebeads.com/diyimages/34741007.jpg, http://www.clearancebeads.com/diyimages/34741007-2.jpg, http://www.clearancebeads.com/diyimages/34741007-3.jpg, http://www.clearancebeads.com/diyimages/34741007-4.jpg, http://www.clearancebeads.com/diyimages/34741007-5.jpg"
