"vItemNumber","vLocation","vDescription","vShortDesc","vLook","vSpecificColor","vGenColor","vGenMaterial","vGenItemType","vShape","vSizeType","vMetalColor","vMetalType","vDimensions","vPcCounts","vKeywords","vOnSale","vFeaturedItem","vSorting","vAggregation","itemprice_1","itemprice_2","quantityonhand","imagefilename"
"47598141","900","These great 3mm light Siam Flatbacks are loose crystal elements backed with platinum foiling for extra brilliance and protection. They are easy to apply to a variety of carrier materials using standard one- or two-component glues. It also has the most progressive and unique cut in the market: multilayer cut technology, producing the inspiring XIRIUS star design.","38 3mm Light Siam Flatback","Swarovski","Light Siam","Red","Crystal","Flatbacks","2088 Xirius Rose",,"","","12ss / 3mm","38","Flatback, Swarovski,  Light Siam","","N",999999,"",2,0,121,"http://www.clearancebeads.com/diyimages/47598141.jpg, http://www.clearancebeads.com/diyimages/47598141-2.jpg, http://www.clearancebeads.com/diyimages/47598141-3.jpg, http://www.clearancebeads.com/diyimages/47598141-4.jpg, http://www.clearancebeads.com/diyimages/47598141-5.jpg"
"63800021","900","Use these copper eye/head pins to connect different elements of your design. Express your creativity by making your own beautiful custom jewelry.","100pc Metal Head&Eye Pins Copper","Findings","","Brown","Copper","Misc Tools","",,"Brown","Iron","2in","100","findings; head pin; eye pin; copper","","N",999999,"",1,0,9449,"http://www.clearancebeads.com/diyimages/63800021.jpg, http://www.clearancebeads.com/diyimages/63800021-2.jpg, http://www.clearancebeads.com/diyimages/63800021-3.jpg, http://www.clearancebeads.com/diyimages/63800021-4.jpg, http://www.clearancebeads.com/diyimages/63800021-5.jpg"
"29494539","900","Use this Singapore Chain Necklace to create a delicate handmade jewelry design. Attach a Swarovski drop pendant to the center of the necklace using a jump ring to create a stunning yet simple design. This chain has a Hallmark .925 on the clasp and the chain.","18in/45cm Elegance Singapore Chain Necklace","Elegance","","Silver","Sterling Silver","Chain","",,"Silver","Silver, Copper","18in, 1.8mm","1","Singapore Chain, Silver, Elegance","","N",999999,"",4.5,8.99,322,"http://www.clearancebeads.com/diyimages/29494539.jpg, http://www.clearancebeads.com/diyimages/29494539-2.jpg, http://www.clearancebeads.com/diyimages/29494539-3.jpg, http://www.clearancebeads.com/diyimages/29494539-4.jpg, http://www.clearancebeads.com/diyimages/29494539-5.jpg"
"29494557","900","Create your own statement jewelry with this Bangle bracelet. Our Elegance line provides you with the best quality sterling silver beads and components for your finer artistic designs.This bracelet has a Hallmark .925. Mix and match it with a variety of charms to create a different look for every day of the week!","65mm Elegance Sterling Silver Bangle","Elegance","","Silver","Sterling Silver","Bracelets","",,"Silver","Silver","2.5in","1","Elegance, sterling silver, bangle","","N",999999,"",6.5,16.99,230,"http://www.clearancebeads.com/diyimages/29494557.jpg, http://www.clearancebeads.com/diyimages/29494557-2.jpg, http://www.clearancebeads.com/diyimages/29494557-3.jpg, http://www.clearancebeads.com/diyimages/29494557-4.jpg, http://www.clearancebeads.com/diyimages/29494557-5.jpg"
"39910209","900","These Channel charms with crystals from Swarovski®are the ideal collectible pieces. Use them to create a look that is unique to you and mark life’s unforgettable moments.","Swarovski Channel charms","Swarovski","Aquamarine, Light Sapphire, Rose","Multi","Base Metal","Charms","Channel",,"Silver","Brass, Iron","15-18mm","3","Swarovski, Channel, Charms","","N",999999,"",3.99,0,417,"http://www.clearancebeads.com/diyimages/39910209.jpg, http://www.clearancebeads.com/diyimages/39910209-2.jpg, http://www.clearancebeads.com/diyimages/39910209-3.jpg, http://www.clearancebeads.com/diyimages/39910209-4.jpg, http://www.clearancebeads.com/diyimages/39910209-5.jpg"
"39910227","900","This Adjustable Bangle Bracelet is perfect to make your very own bracelet! You can add the charms that speak to your insirations, and change them to suit your desires.","Swarovski Adjustable Bangle Bracelet","Swarovski","Crystal","Clear/Crystal","Base Metal","Jewelry","",,"Silver","Brass, Iron","2.7in","1","Swarovski, adjustable, bangle, bracelet","","N",999999,"",3.99,0,509,"http://www.clearancebeads.com/diyimages/39910227.jpg, http://www.clearancebeads.com/diyimages/39910227-2.jpg, http://www.clearancebeads.com/diyimages/39910227-3.jpg, http://www.clearancebeads.com/diyimages/39910227-4.jpg, http://www.clearancebeads.com/diyimages/39910227-5.jpg"
"39910245","900","This Inspire charm with crystals from Swarovski® with a Bracelet is the perfect gift for any jewelry lover. You can add the charms that speak to your insirations, and change them to suit your desires.","Swarovski Bracelet and Inspire Charm","Swarovski","Crystal","Silver","Base Metal","Jewelry","Inspire",,"Silver","Brass, Iron","7.5in","4","Swarovski, Bracelet, word, inspire, Charm","","N",999999,"",7.99,0,171,"http://www.clearancebeads.com/diyimages/39910245.jpg, http://www.clearancebeads.com/diyimages/39910245-2.jpg, http://www.clearancebeads.com/diyimages/39910245-3.jpg, http://www.clearancebeads.com/diyimages/39910245-4.jpg, http://www.clearancebeads.com/diyimages/39910245-5.jpg"
"34713136","900","Faceted Beads will create beautiful pieces of jewelry that everyone will love. Whether you are designing necklaces; bracelets; earrings or more; These beads will make your creations stand out among the rest! This package includes 45 pieces of 4mm faceted rounds in metallic.","45pc 4mm Faceted Round - Metallic","Beads","","Silver","Glass","Glass Beads","Round",,"","","4mm","45","faceted round, bead","","N",999999,"",2,0,581,"http://www.clearancebeads.com/diyimages/34713136.jpg, http://www.clearancebeads.com/diyimages/34713136-2.jpg, http://www.clearancebeads.com/diyimages/34713136-3.jpg, http://www.clearancebeads.com/diyimages/34713136-4.jpg, http://www.clearancebeads.com/diyimages/34713136-5.jpg"
"37600005","900","Create your own jewelry with this LaurDIY Galaxy DIY Jewelry Kit. This kit includes 3 projects with easy-to-follow instructions. Each large LaurDIY kit includes 1 collectible LaurDIY bracelet. Collect them all!","LaurDIY Galaxy DIY Jewelry Kit","LaurDIY","","Silver","Base Metal","Jewelry","",,"Silver","Zinc, Copper","","","jewelry; cousindiy; cousin; youtuber; diy kit; kit; laurdiy; lauren riihimaki","","N",999999,"",12.5,24.99,121,"http://www.clearancebeads.com/diyimages/37600005.jpg, http://www.clearancebeads.com/diyimages/37600005-2.jpg, http://www.clearancebeads.com/diyimages/37600005-3.jpg, http://www.clearancebeads.com/diyimages/37600005-4.jpg, http://www.clearancebeads.com/diyimages/37600005-5.jpg"
"34734139","900","Fun Pack of pastel pony beads are great for any large bead projects or group bead projects. Entertain and add a dash of color to create unique projects that will put a smile on your little crafters faces.","Fun Pack Pastel Pony Beads","Kids","","Multi","Acrylic","Pony Beads","Pony Bead",,"","","6x9mm","700","Fun Pack, kids beads, round pony beads,  pastel pony beads, pastel assortment of beads, pony beads","","N",999999,"",2.5,4.99,500,"http://www.clearancebeads.com/diyimages/34734139.jpg, http://www.clearancebeads.com/diyimages/34734139-2.jpg, http://www.clearancebeads.com/diyimages/34734139-3.jpg, http://www.clearancebeads.com/diyimages/34734139-4.jpg, http://www.clearancebeads.com/diyimages/34734139-5.jpg"
"47645562","900","This blue and green mix is great for any sparkly project. Flatbacks  are loose crystal elements backed with platinum foiling for extra brilliance and protection. They are easy to apply to a variety of carrier materials using standard one- or two-component glues. It also has the most progressive and unique cut in the market: multilayer cut technology, producing the inspiring XIRIUS star design.","80pc Blue and Green Flatback Mix","Swarovski","Light Sapphire, Peridot, Sapphire","Multi","Crystal","Flatbacks","2088 Xirius Rose",,"","","12ss / 3mm, 16ss / 3.8mm, 20ss / 4.6mm","80","Flatback, Swarovski, Mix, Blue, Green","","N",999999,"",5,0,125,"http://www.clearancebeads.com/diyimages/47645562.jpg, http://www.clearancebeads.com/diyimages/47645562-2.jpg, http://www.clearancebeads.com/diyimages/47645562-3.jpg, http://www.clearancebeads.com/diyimages/47645562-4.jpg, http://www.clearancebeads.com/diyimages/47645562-5.jpg"
"34734136","900","Fun Pack of transparent rainbow pony beads are great for any large bead projects or group bead projects. Entertain and add a dash of color to create unique projects that will put a smile on your little crafters faces.","Fun Pack Transparent Rainbow Pony Beads","Kids","","Multi","Acrylic","Pony Beads","Pony Bead",,"","","6x9mm","700","Fun Pack, kids beads, round pony beads, transparent rainbow pony beads, rainbow assortment of beads, pony beads","","N",999999,"",2.5,4.99,534,"http://www.clearancebeads.com/diyimages/34734136.jpg, http://www.clearancebeads.com/diyimages/34734136-2.jpg, http://www.clearancebeads.com/diyimages/34734136-3.jpg, http://www.clearancebeads.com/diyimages/34734136-4.jpg, http://www.clearancebeads.com/diyimages/34734136-5.jpg"
"35031081","900","These vibrant glass bottle accents will add a unique touch to any of your custom jewelry creations. These Clear glass bottle accent with cork and silver plated eye screw are perfect for bracelets, necklaces, and other jewelry creations.","3pc Glass Bottle Accent","Charms & Pendants","","Clear/Crystal","Glass","Pendants","bottle",,"","","42x12mm","3","accent, glass bottle, pendant","","N",999999,"",2,0,592,"http://www.clearancebeads.com/diyimages/35031081.jpg, http://www.clearancebeads.com/diyimages/35031081-2.jpg, http://www.clearancebeads.com/diyimages/35031081-3.jpg, http://www.clearancebeads.com/diyimages/35031081-4.jpg, http://www.clearancebeads.com/diyimages/35031081-5.jpg"
"47500100","900","These 4mm Crystal Bicone Beads offer the highest standard available on the market. The high-quality precision cutting and the clear through-hole achieve high brilliance and clarity. Rounded hole edges reduce the wear on thread and increase the durability of designs. They are available in the latest fashion colors, effects, and cuts. The main application techniques are beading, wiring, stringing, and weaving.","30pc 4mm Bicone Crystal","Swarovski","Crystal","Clear/Crystal","Crystal","Beads","5328 Xilion Bead",,"","","4mm","30","Swarovski, Bicone, Beads, Crystal","","N",999999,"",3,0,2246,"http://www.clearancebeads.com/diyimages/47500100.jpg, http://www.clearancebeads.com/diyimages/47500100-2.jpg, http://www.clearancebeads.com/diyimages/47500100-3.jpg, http://www.clearancebeads.com/diyimages/47500100-4.jpg, http://www.clearancebeads.com/diyimages/47500100-5.jpg"
"63515523","900","Let summer come to your jewelry designs with these bright and beautiful accents. A loop at the top of the accent makes it easy to add to designs. These yellow drops are perfect to create earrings or to add to a beaded necklace.","6pc Acrylic/Metal Neon Yellow Drops Accents","Charms & Pendants","","Yellow","Base Metal","Charms","Teardrop",,"Gold","Zinc","21x15mm","6","accents, neon yellow, drops, summer accents","","N",999999,"",1.5,0,8336,"http://www.clearancebeads.com/diyimages/63515523.jpg, http://www.clearancebeads.com/diyimages/63515523-2.jpg, http://www.clearancebeads.com/diyimages/63515523-3.jpg, http://www.clearancebeads.com/diyimages/63515523-4.jpg, http://www.clearancebeads.com/diyimages/63515523-5.jpg"
"34718105","900","This splendid copper oval link chain provides the perfect base for your custom jewelry creations. Pair it with your favorite charm or pendant for a unique style.","62in/157.48cm Copper Oval Link Chain","Chains","Antique Copper","Brown","Base Metal","Chain","",,"Copper","Iron","62in","1","Link Chain, Oval, Copper","","N",999999,"",2,3.99,201,"http://www.clearancebeads.com/diyimages/34718105.jpg, http://www.clearancebeads.com/diyimages/34718105-2.jpg, http://www.clearancebeads.com/diyimages/34718105-3.jpg, http://www.clearancebeads.com/diyimages/34718105-4.jpg, http://www.clearancebeads.com/diyimages/34718105-5.jpg"
"47542193","900","This Aurora Borealis leaf Pendant will look amazing on any necklace base!  Pendants offer a whole range of design possibilities for different segments thanks to their easy application, with the top hole requiring only a jump ring/pinch bail with a chain or cord. Due to the diverse range of sizes available, Pendants are ideal for creating jewelry sets such as necklaces, bracelets, and earrings.","23mm Aurora Borelis Leaf Pendant","Swarovski","Crystal Aurore Boreale","Clear/Crystal","Crystal","Pendants","6734 Pure Leaf Pendant",,"","","23mm","1","Swarovski, Leaf, Pendant, Aurora Borealis","","N",999999,"",4.5,0,2043,"http://www.clearancebeads.com/diyimages/47542193.jpg, http://www.clearancebeads.com/diyimages/47542193-2.jpg, http://www.clearancebeads.com/diyimages/47542193-3.jpg, http://www.clearancebeads.com/diyimages/47542193-4.jpg, http://www.clearancebeads.com/diyimages/47542193-5.jpg"
"63800292","900","This great silver metal cones is the perfect finding to add to your homemade jewelry creations. Use it to create lovely necklace and bracelet!","4pc Metal Cones Silver","Findings","","Silver","Base Metal","Misc Tools","",,"Silver","Zinc","18x9mm","4","findings; silver; cones","","N",999999,"",1,0,3492,"http://www.clearancebeads.com/diyimages/63800292.jpg, http://www.clearancebeads.com/diyimages/63800292-2.jpg, http://www.clearancebeads.com/diyimages/63800292-3.jpg, http://www.clearancebeads.com/diyimages/63800292-4.jpg, http://www.clearancebeads.com/diyimages/63800292-5.jpg"
"4477","900","These Parrot Beak Memory wire cutter have strong by-pass cutting jaws that will handle the toughest wires like Memory wire and floral wire. It features a Stainless steel body with soft grip cushion handles for added comfort and more secure grip.","Parrot Beak Memory Wire cutter","Tools","","Yellow","Steel","Pliers & Cutters","",,"","Manganesse steel","5x2in","1","Parrot Break Memory wire cutter, tools","","N",999999,"",2,3.99,189,"http://www.clearancebeads.com/diyimages/4477.jpg, http://www.clearancebeads.com/diyimages/4477-2.jpg, http://www.clearancebeads.com/diyimages/4477-3.jpg, http://www.clearancebeads.com/diyimages/4477-4.jpg, http://www.clearancebeads.com/diyimages/4477-5.jpg"
"34734137","900","Fun Pack of rainbow pony beads are great for any large bead projects or group bead projects. Entertain and add a dash of color to create unique projects that will put a smile on your little crafters faces.","Fun Pack Rainbow Pony Beads","Kids","","Multi","Acrylic","Pony Beads","Pony Bead",,"","","6x9mm","700","Fun Pack, kids beads, round pony beads,  rainbow pony beads, rainbow assortment of beads, pony beads","","N",999999,"",2.5,4.99,908,"http://www.clearancebeads.com/diyimages/34734137.jpg, http://www.clearancebeads.com/diyimages/34734137-2.jpg, http://www.clearancebeads.com/diyimages/34734137-3.jpg, http://www.clearancebeads.com/diyimages/34734137-4.jpg, http://www.clearancebeads.com/diyimages/34734137-5.jpg"
"34734138","900","Fun Pack of neon pony beads are great for any large bead projects or group bead projects. Entertain and add a dash of color to create unique projects that will put a smile on your little crafters faces.","Fun Pack Neon Pony Beads","Kids","","Multi","Acrylic","Pony Beads","Pony Bead",,"","","6x9mm","700","Fun Pack, kids beads, round pony beads,  neon pony beads, neon assortment of beads, pony beads","","N",999999,"",2.5,4.99,948,"http://www.clearancebeads.com/diyimages/34734138.jpg, http://www.clearancebeads.com/diyimages/34734138-2.jpg, http://www.clearancebeads.com/diyimages/34734138-3.jpg, http://www.clearancebeads.com/diyimages/34734138-4.jpg, http://www.clearancebeads.com/diyimages/34734138-5.jpg"
"47628905","900","This Flower shaped Slider Bead offer the highest standard available on the market. You can use 4mm flat back  Swarovski® Crystals to personalize it and make a really unique design that will really stand out.","1pc Swarovski Flower Metal Slider Bead","Swarovski","","Silver","Base Metal","Metal Beads","",,"Silver","Zinc","","1","Swarovski, Flower, Slider, Beads","","N",999999,"",2,0,690,"http://www.clearancebeads.com/diyimages/47628905.jpg, http://www.clearancebeads.com/diyimages/47628905-2.jpg, http://www.clearancebeads.com/diyimages/47628905-3.jpg, http://www.clearancebeads.com/diyimages/47628905-4.jpg, http://www.clearancebeads.com/diyimages/47628905-5.jpg"
"47645532","900","These beautiful rhinestones come in two colors: Rose and Ruby ! Flat Back Crystals are loose crystal elements backed with platinum foiling for extra brilliance and protection. They are easy to apply to a variety of carrier materials using standard one- or two-component glues. It also has the most progressive and unique cut in the market: multilayer cut technology, producing the inspiring XIRIUS star design.","80pc Swarovski Rose/Ruby Flatback Mix","Swarovski","Rose, Ruby","Red","Crystal","Flatbacks","2088 Xirius Rose",,"","","12ss / 3mm, 16ss / 3.8mm, 20ss / 4.6mm","80","Flatback, Swarovski, Mix, Rose, Ruby","","N",999999,"",5,0,1183,"http://www.clearancebeads.com/diyimages/47645532.jpg, http://www.clearancebeads.com/diyimages/47645532-2.jpg, http://www.clearancebeads.com/diyimages/47645532-3.jpg, http://www.clearancebeads.com/diyimages/47645532-4.jpg, http://www.clearancebeads.com/diyimages/47645532-5.jpg"
"34708239","900","These cute flower bead caps add the perfect touch to your homemade jewelry creations.  Accentuate your custom necklaces and bracelets with this fashionable collection.","30pc 10mm Metal Flower Bead Cap Silver","Beads","","Silver","Base Metal","Metal Beads","Flower",,"Silver","Zinc","10mm","30","flower, bead cap, silver","","N",999999,"",2,0,1942,"http://www.clearancebeads.com/diyimages/34708239.jpg, http://www.clearancebeads.com/diyimages/34708239-2.jpg, http://www.clearancebeads.com/diyimages/34708239-3.jpg, http://www.clearancebeads.com/diyimages/34708239-4.jpg, http://www.clearancebeads.com/diyimages/34708239-5.jpg"
"34708265","900","A vibrant collection of rondelle beads that will sparkle in your homemade jewelry creations.  Use this wonderful set of to accent alluring bracelets or necklaces with individual style!","8pc 4X8 Rondelle Gold/Crystal","Beads","","Gold","Base Metal","Metal Beads","Rondelle",,"Gold","Brass","4x8mm","8","rondelle, bead","","N",999999,"",2,3.99,2917,"http://www.clearancebeads.com/diyimages/34708265.jpg, http://www.clearancebeads.com/diyimages/34708265-2.jpg, http://www.clearancebeads.com/diyimages/34708265-3.jpg, http://www.clearancebeads.com/diyimages/34708265-4.jpg, http://www.clearancebeads.com/diyimages/34708265-5.jpg"
"37600004","900","Create your own jewelry with this LaurDIY Natural Festival DIY Jewelry Kit. This kit includes 3 projects with easy-to-follow instructions. This kit features a druzy pendant and silver and white colors. Each large LaurDIY kit includes 1 collectible LaurDIY bracelet. Collect them all!","LaurDIY Natural Festival DIY Jewelry Kit","LaurDIY","","Silver","Base Metal","Jewelry","",,"Silver","Zinc, Iron, Copper","","","jewelry; cousindiy; cousin; youtuber; diy kit; kit; laurdiy; lauren riihimaki","","N",999999,"",12.5,24.99,855,"http://www.clearancebeads.com/diyimages/37600004.jpg, http://www.clearancebeads.com/diyimages/37600004-2.jpg, http://www.clearancebeads.com/diyimages/37600004-3.jpg, http://www.clearancebeads.com/diyimages/37600004-4.jpg, http://www.clearancebeads.com/diyimages/37600004-5.jpg"
"34708460","900","This vibrant 11 piece charm set is perfect for embellishing necklaces and bracelets that reflect your personality. This ""aqua""set is composed of metal and glass beads. There's no better way to express your style! Also, These charms are an excellent way to thoughtfully personalize gifts.","11pc Glass/Metal Bead Cluster Aqua","Charms & Pendants","Aqua","Green","Glass","Charms","",,"Silver","","14-24mm","11","charms, cluster bead, aqua","","N",999999,"",2,3.99,4197,"http://www.clearancebeads.com/diyimages/34708460.jpg, http://www.clearancebeads.com/diyimages/34708460-2.jpg, http://www.clearancebeads.com/diyimages/34708460-3.jpg, http://www.clearancebeads.com/diyimages/34708460-4.jpg, http://www.clearancebeads.com/diyimages/34708460-5.jpg"
"37600001","900","Create your own jewelry with this LaurDIY Wire DIY Jewelry Kit. This kit includes 3 projects with easy-to-follow instructions. This kit features purple, teal, and gold colors. Each large LaurDIY kit includes 1 collectible LaurDIY bracelet. Collect them all!","LaurDIY Wire DIY Jewelry Kit","LaurDIY","","Gold","Base Metal","Jewelry","",,"Gold","Copper, Zinc, Iron","","","jewelry; cousindiy; cousin; youtuber; diy kit; kit; laurdiy; lauren riihimaki","","N",999999,"",12.5,24.99,38,"http://www.clearancebeads.com/diyimages/37600001.jpg, http://www.clearancebeads.com/diyimages/37600001-2.jpg, http://www.clearancebeads.com/diyimages/37600001-3.jpg, http://www.clearancebeads.com/diyimages/37600001-4.jpg, http://www.clearancebeads.com/diyimages/37600001-5.jpg"
"34708522","900","This accent is perfect to create a stunning necklace. Made of metal, this stunning pendant offers a antique gold finish with beautiful details and a green gemstone. Add it to a chain or cord for a dazzling necklace to wear with your favorite outfits!","1pc Metal Diamond Shaped Accent Gold/Green with Cabochon","Charms & Pendants","","Green","Base Metal","Pendants","oval",,"Antique Gold","Zinc","60x48mm","1","accent, diamond shaped, pendant, cabochon","","N",999999,"",2,3.99,2276,"http://www.clearancebeads.com/diyimages/34708522.jpg, http://www.clearancebeads.com/diyimages/34708522-2.jpg, http://www.clearancebeads.com/diyimages/34708522-3.jpg, http://www.clearancebeads.com/diyimages/34708522-4.jpg, http://www.clearancebeads.com/diyimages/34708522-5.jpg"
"39910243","900","This baroque pendant with crystals from Swarovski® with a Bracelet is the perfect gift for any jewelry lover. You can add the charms that speak to your insirations, and change them to suit your desires.","Swarovski Bracelet and Baroque Pendant Charm","Swarovski","Crystal Aurore Boreale, Crystal","Clear/Crystal","Base Metal","Jewelry","Baroque",,"Silver","Brass, Iron","7.5in","2","Swarovski, Bracelet, Baroque Pendant, Charm","","N",999999,"",7.99,0,181,"http://www.clearancebeads.com/diyimages/39910243.jpg, http://www.clearancebeads.com/diyimages/39910243-2.jpg, http://www.clearancebeads.com/diyimages/39910243-3.jpg, http://www.clearancebeads.com/diyimages/39910243-4.jpg, http://www.clearancebeads.com/diyimages/39910243-5.jpg"
"64100011","900","Ideal for all your jewelry making and beading projects, this photo charm kit contains everything you need to create 1 Necklace, 1 Bracelet and 2 earrings sets . This kit contains 356 pieces and you can personalize the necklace with your own picture. Perfect gift for family and friends!","356pc Photo Charm Jewelry Kit","Kits","","Cream/Off-White","Plastic","Jewelry","",,"Silver","","","356","jewelry kit, photo charm","","N",999999,"",2,0,150,"http://www.clearancebeads.com/diyimages/64100011.jpg, http://www.clearancebeads.com/diyimages/64100011-2.jpg, http://www.clearancebeads.com/diyimages/64100011-3.jpg, http://www.clearancebeads.com/diyimages/64100011-4.jpg, http://www.clearancebeads.com/diyimages/64100011-5.jpg"
"47645529","900","These beautiful rhinestones come in two colors: emerald and blue zircon! Flat Back Crystals are loose crystal elements backed with platinum foiling for extra brilliance and protection. They are easy to apply to a variety of carrier materials using standard one- or two-component glues. It also has the most progressive and unique cut in the market: multilayer cut technology, producing the inspiring XIRIUS star design.","80pc Swarovski Emerald/Blue Zircon Flatback Mix","Swarovski","Blue Zircon, Emerald","Multi","Crystal","Flatbacks","2088 Xirius Rose",,"","","12ss / 3mm, 16ss / 3.8mm, 20ss / 4.6mm","80","Flatback, Swarovski, Mix, Emerald, blue zircon","","N",999999,"",5,0,2990,"http://www.clearancebeads.com/diyimages/47645529.jpg, http://www.clearancebeads.com/diyimages/47645529-2.jpg, http://www.clearancebeads.com/diyimages/47645529-3.jpg, http://www.clearancebeads.com/diyimages/47645529-4.jpg, http://www.clearancebeads.com/diyimages/47645529-5.jpg"
"47682905","900","Add a dazzling accent to your jewelry with this Teardrop Chandelier. You can use a 14mm Rivoli to personalize it and make a really unique design that will really stand out.","1Set Metal Silver Teardrop Chandelier","Swarovski","","Silver","Base Metal","Connectors","Teardrop",,"Silver","Zinc","52x34mm","2","Swarovski, Teardrop, Chandelier, base","","N",999999,"",2.5,0,501,"http://www.clearancebeads.com/diyimages/47682905.jpg, http://www.clearancebeads.com/diyimages/47682905-2.jpg, http://www.clearancebeads.com/diyimages/47682905-3.jpg, http://www.clearancebeads.com/diyimages/47682905-4.jpg, http://www.clearancebeads.com/diyimages/47682905-5.jpg"
"63815150","900","This antique gold twist chain provides the perfect base for your custom jewelry creations. Use it to create lovely necklace and bracelet jewelry paired with your favorite charms.","48in/121.92cm Twist Chain- Antique Gold","Chains","","Gold","Base Metal","Chain","",,"Antique Gold","Iron","48in, 5.2mm","1","twist chain, antique gold","","N",999999,"",1.5,0,7998,"http://www.clearancebeads.com/diyimages/63815150.jpg, http://www.clearancebeads.com/diyimages/63815150-2.jpg, http://www.clearancebeads.com/diyimages/63815150-3.jpg, http://www.clearancebeads.com/diyimages/63815150-4.jpg, http://www.clearancebeads.com/diyimages/63815150-5.jpg"
