"vItemNumber","vLocation","vDescription","vShortDesc","vLook","vSpecificColor","vGenColor","vGenMaterial","vGenItemType","vShape","vSizeType","vMetalColor","vMetalType","vDimensions","vPcCounts","vKeywords","vOnSale","vFeaturedItem","vSorting","vAggregation","itemprice_1","itemprice_2","quantityonhand","imagefilename"
"34699710","900","Our Celeste bracelet Kit is the easiest way to create a beautiful piece of personalized jewelry. This bracelet kit contains 16 pieces that are color-coordinated for stylish visual impact. With the variety of pieces available in this jewelry making kit, and various options available, any bracelet you make will be funky and eye-catching. Combine these bracelet accents in any order to create an attractive accessory that suits your own style.","16pc Celeste Large Hole Bead Kit","Kits","","Blue","Glass","Jewelry","",,"Silver","","","16","bracelet, kit, large hole bead, celeste","","N",999999,"",5,0,224,"http://www.clearancebeads.com/diyimages/34699710.jpg, http://www.clearancebeads.com/diyimages/34699710-2.jpg, http://www.clearancebeads.com/diyimages/34699710-3.jpg, http://www.clearancebeads.com/diyimages/34699710-4.jpg, http://www.clearancebeads.com/diyimages/34699710-5.jpg"
"34699718","900","Our Oceanus bracelet Kit is the easiest way to create a beautiful piece of personalized jewelry. This bracelet kit contains 1 pieces that are color-coordinated for stylish visual impact. With the variety of pieces available in this jewelry making kit, and various options available, any bracelet you make will be funky and eye-catching. Combine these bracelet accents in any order to create an attractive accessory that suits your own style.","13pc Oceanus Large Hole Bead Kit","Kits","","Multi","Ceramic","Jewelry","",,"Silver","","","13","bracelet, kit, large hole bead, Oceanus","","N",999999,"",5,0,621,"http://www.clearancebeads.com/diyimages/34699718.jpg, http://www.clearancebeads.com/diyimages/34699718-2.jpg, http://www.clearancebeads.com/diyimages/34699718-3.jpg, http://www.clearancebeads.com/diyimages/34699718-4.jpg, http://www.clearancebeads.com/diyimages/34699718-5.jpg"
"47608357","900","These 8mm Paradise Shine Triangle Pendants have timeless elegance!  Pendants offer a whole range of design possibilities for different segments thanks to their easy application, with the top hole requiring only a jump ring/pinch bail with a chain or cord. Due to the diverse range of sizes available, Pendants are ideal for creating jewelry sets such as necklaces, bracelets, and earrings.","8mm Paradise Shine triangle Pendants","Swarovski","Paradise Shine","Green","Crystal","Pendants","6628 Xilion Triangle Pendant",,"","","8mm","6","Pendant, Swarovski, Paradise Shine, triangle","","N",999999,"",0,0,35,"http://www.clearancebeads.com/diyimages/47608357.jpg, http://www.clearancebeads.com/diyimages/47608357-2.jpg, http://www.clearancebeads.com/diyimages/47608357-3.jpg, http://www.clearancebeads.com/diyimages/47608357-4.jpg, http://www.clearancebeads.com/diyimages/47608357-5.jpg"
"47610249","900","These 14mm Vitrail Light  Rivoli offer a whole range of design possibilities for different segments thanks to their easy application, with the top hole requiring only a jump ring/pinch bail with a chain or cord. Due to the diverse range of sizes available, Pendants are ideal for creating jewelry sets such as necklaces, bracelets, and earrings.","2pc 14mm Vitrail Light Rivoli","Swarovski","Vitrail Light","Purple","Crystal","Charms","1122.0",,"","","14mm","2","Vitrail Light, Rivoli, Swarovski","","N",999999,"",3,0,383,"http://www.clearancebeads.com/diyimages/47610249.jpg, http://www.clearancebeads.com/diyimages/47610249-2.jpg, http://www.clearancebeads.com/diyimages/47610249-3.jpg, http://www.clearancebeads.com/diyimages/47610249-4.jpg, http://www.clearancebeads.com/diyimages/47610249-5.jpg"
"47612245","900","These Bermuda Blue Spike offer the highest standard available on the market. The high-quality precision cutting and the clear through-hole achieve high brilliance and clarity. Rounded hole edges reduce the wear on thread and increase the durability of designs. They are available in the latest fashion colors, effects, and cuts. The main application techniques are beading, wiring, stringing, and weaving.","2pc Bermuda Blue Spike","Swarovski","Crystal Bermuda Blue","Blue","Crystal","Beads","6480 Spike Pendant",,"","","18mm","2","Spike, Bermuda Blue","","N",999999,"",0,0,416,"http://www.clearancebeads.com/diyimages/47612245.jpg, http://www.clearancebeads.com/diyimages/47612245-2.jpg, http://www.clearancebeads.com/diyimages/47612245-3.jpg, http://www.clearancebeads.com/diyimages/47612245-4.jpg, http://www.clearancebeads.com/diyimages/47612245-5.jpg"
"64011232","900","A must-have for jewelry makers, this rose gold starter pack is perfect to make any kind of handmade jewelry. It is also a great item to start or replenish your personal jewelry findings collection.","75pc Rose Gold Starter Kit","Findings","","Rose Gold","Copper","Misc Tools","",,"Rose Gold","Copper, Zinc","","75","findings; rose gold; starter kit","","N",999999,"",1.5,0,5635,"http://www.clearancebeads.com/diyimages/64011232.jpg, http://www.clearancebeads.com/diyimages/64011232-2.jpg, http://www.clearancebeads.com/diyimages/64011232-3.jpg, http://www.clearancebeads.com/diyimages/64011232-4.jpg, http://www.clearancebeads.com/diyimages/64011232-5.jpg"
"64100030","900","Learn how to bead! This kit contains everything you need to get started! You will find in this kit the supplies for an earring set, a necklace, a bracelet but also the tools and the design pattern. Perfect gift for beginners!","I Can Bead Kit","Kits","","Multi","Base Metal","Jewelry","",,"Silver","Iron","","42","I can, kit, bead","","N",999999,"",5,0,3072,"http://www.clearancebeads.com/diyimages/64100030.jpg, http://www.clearancebeads.com/diyimages/64100030-2.jpg, http://www.clearancebeads.com/diyimages/64100030-3.jpg, http://www.clearancebeads.com/diyimages/64100030-4.jpg, http://www.clearancebeads.com/diyimages/64100030-5.jpg"
"47615189","900","These Antique pink heart Flatbacks are loose crystal elements backed with platinum foiling for extra brilliance and protection. They are easy to apply to a variety of carrier materials using standard one- or two-component glues. It also has the most progressive and unique cut in the market: multilayer cut technology, producing the inspiring XIRIUS star design.","6pc 6mm Antique Pink Heart Flatback","Swarovski","Crystal Antique Pink","Pink","Crystal","Flatbacks","2808 Heart Flat Back",,"","","6mm","6","Flatback, Swarovski, Antique Pink, Heart","","N",999999,"",3,0,86,"http://www.clearancebeads.com/diyimages/47615189.jpg, http://www.clearancebeads.com/diyimages/47615189-2.jpg, http://www.clearancebeads.com/diyimages/47615189-3.jpg, http://www.clearancebeads.com/diyimages/47615189-4.jpg, http://www.clearancebeads.com/diyimages/47615189-5.jpg"
"63815188","900","These cute silver heart spacers add the perfect touch to your homemade jewelry creations.  Accentuate your custom necklaces and bracelets with this fashionable collection.","27pc Metal Silver Heart Spacer","Beads","","Silver","Base Metal","Metal Beads","Spacer",,"Silver","Zinc","","27","heart, spacer, silver","","N",999999,"",1,0,0,"http://www.clearancebeads.com/diyimages/63815188.jpg, http://www.clearancebeads.com/diyimages/63815188-2.jpg, http://www.clearancebeads.com/diyimages/63815188-3.jpg, http://www.clearancebeads.com/diyimages/63815188-4.jpg, http://www.clearancebeads.com/diyimages/63815188-5.jpg"
"39910211","900","These Dream Word charms with crystals from Swarovski® are the ideal collectible pieces. Use them to create a look that is unique to you and mark life’s unforgettable moments.","Swarovski word ""dream""charms","Swarovski","Crystal","Silver","Base Metal","Charms","",,"Silver","Brass, Iron","14-16mm","3","Swarovski, word, dream, charms","","N",999999,"",3.99,0,170,"http://www.clearancebeads.com/diyimages/39910211.jpg, http://www.clearancebeads.com/diyimages/39910211-2.jpg, http://www.clearancebeads.com/diyimages/39910211-3.jpg, http://www.clearancebeads.com/diyimages/39910211-4.jpg, http://www.clearancebeads.com/diyimages/39910211-5.jpg"
"34709536","900","Show your love for DC Comics with this beautiful Wonder Woman accent. Perfect addition to your keys or accessories. Show off your geek-chic passion for your favorite iconic characters.","1pc Wonder Woman Accent","DC Comics","","Multi","Base Metal","Pendants","",,"Silver","Zinc","2.53x1.56in","1","Wonder Woman; Accent; DC comics","","N",999999,"",4.495,8.99,0,"http://www.clearancebeads.com/diyimages/34709536.jpg, http://www.clearancebeads.com/diyimages/34709536-2.jpg, http://www.clearancebeads.com/diyimages/34709536-3.jpg, http://www.clearancebeads.com/diyimages/34709536-4.jpg, http://www.clearancebeads.com/diyimages/34709536-5.jpg"
"2949776","900","Use this Gold Plated Slide-A-Bead Chain to create a delicate handmade jewelry design. Our Elegance line provides you with the best quality sterling silver beads and components for your finer artistic designs. Attach any pendant to the center of the necklace using a jump ring to create a stunning yet simple design.","18in/45.7cm Slide-A-Bead 14k Gold Plated Chain","Elegance","","Gold","Gold Plated","Chain","",,"Gold","Copper, Gold","18in, .7mm","1","Slide-A-Bead Chain, Gold Plated, Elegance","","N",999999,"",2.5,0,1628,"http://www.clearancebeads.com/diyimages/2949776.jpg, http://www.clearancebeads.com/diyimages/2949776-2.jpg, http://www.clearancebeads.com/diyimages/2949776-3.jpg, http://www.clearancebeads.com/diyimages/2949776-4.jpg, http://www.clearancebeads.com/diyimages/2949776-5.jpg"
"34709497","900","Show your love for DC Comics with this Batman Beads. Perfect for adding a strong accent to your jewelry projects, keys and more. Show off your geek-chic passion for your favorite iconic characters.","3pc Batman Beads","DC Comics","","Silver","Base Metal","Metal Beads","",,"Silver","Zinc",".43x.5in","3","Batman; Beads; DC comics","","N",999999,"",3.495,6.99,0,"http://www.clearancebeads.com/diyimages/34709497.jpg, http://www.clearancebeads.com/diyimages/34709497-2.jpg, http://www.clearancebeads.com/diyimages/34709497-3.jpg, http://www.clearancebeads.com/diyimages/34709497-4.jpg, http://www.clearancebeads.com/diyimages/34709497-5.jpg"
"2950208","900","Use these silver Plate closed jump rings to connect different elements of your design. Our Elegance line provides you with the best quality starling silver beads and components for your finer artistic designs.","30pc 4mm Silver Plate Closed Jump Ring","Findings","","Silver","Silver Plated","Jump Rings","",,"Silver","Copper, Silver","4mm","30","findings; silver plate; elegance; closed jump ring","","N",999999,"",2,3.99,465,"http://www.clearancebeads.com/diyimages/2950208.jpg, http://www.clearancebeads.com/diyimages/2950208-2.jpg, http://www.clearancebeads.com/diyimages/2950208-3.jpg, http://www.clearancebeads.com/diyimages/2950208-4.jpg, http://www.clearancebeads.com/diyimages/2950208-5.jpg"
"34709477","900","Show your love for DC Comics with this Superman Dog Tag. Add it to your pet necklace to show your love of your favorite iconic characters.","1pc Superman Dog Tag","DC Comics","","Silver","Stainless Steel","Pendants","Dog Tag",,"Silver","Stainless Steel","2.29x.95in","1","Superman; Dog Tag; DC comics","","N",999999,"",3.995,7.99,0,"http://www.clearancebeads.com/diyimages/34709477.jpg, http://www.clearancebeads.com/diyimages/34709477-2.jpg, http://www.clearancebeads.com/diyimages/34709477-3.jpg, http://www.clearancebeads.com/diyimages/34709477-4.jpg, http://www.clearancebeads.com/diyimages/34709477-5.jpg"
"47500508","900","This Sea Breeze mix of 30 4mm bicone beads offer offer the highest standard available on the market. The high-quality precision cutting and the clear through-hole achieve high brilliance and clarity. Rounded hole edges reduce the wear on thread and increase the durability of designs. They are available in the latest fashion colors, effects, and cuts. The main application techniques are beading, wiring, stringing, and weaving.","30pc Sea Breeze Bicone Mix","Swarovski","Aquamarine, Blue Zircon, Crystal Aurore Boreale, E","Multi","Crystal","Beads","5328 Xilion Bead",,"","","4mm","30","Swarovski, Bicone, Beads, Mix, Sea breeze","","N",999999,"",3,0,1075,"http://www.clearancebeads.com/diyimages/47500508.jpg, http://www.clearancebeads.com/diyimages/47500508-2.jpg, http://www.clearancebeads.com/diyimages/47500508-3.jpg, http://www.clearancebeads.com/diyimages/47500508-4.jpg, http://www.clearancebeads.com/diyimages/47500508-5.jpg"
"47500391","900","These 4mm Blue diamond shimmer Bicone Beads offer the highest standard available on the market. The high-quality precision cutting and the clear through-hole achieve high brilliance and clarity. Rounded hole edges reduce the wear on thread and increase the durability of designs. They are available in the latest fashion colors, effects, and cuts. The main application techniques are beading, wiring, stringing, and weaving.","4mm Black Diamond Shimmer Bicone","Swarovski","Black Diamond Shimmer","Grey","Crystal","Beads","5328 Xilion Bead",,"","","4mm","24","Swarovski, Bicone, Beads, Shimmer, Blue Diamond","","N",999999,"",0,0,459,"http://www.clearancebeads.com/diyimages/47500391.jpg, http://www.clearancebeads.com/diyimages/47500391-2.jpg, http://www.clearancebeads.com/diyimages/47500391-3.jpg, http://www.clearancebeads.com/diyimages/47500391-4.jpg, http://www.clearancebeads.com/diyimages/47500391-5.jpg"
"29502126","900","Use these silver plate flower head pin to connect different elements of your design. Our Elegance line provides you with the best quality starling silver beads and components for your finer artistic designs. Express your creativity by making your own beautiful custom jewelry.","10pc Silver Plate Flower Head Pin","Findings","","Silver","Silver Plated","Head Pins","",,"Silver","Copper, Silver","2in","10","findings; silver plate; flower head pin","","N",999999,"",2,3.99,1295,"http://www.clearancebeads.com/diyimages/29502126.jpg, http://www.clearancebeads.com/diyimages/29502126-2.jpg, http://www.clearancebeads.com/diyimages/29502126-3.jpg, http://www.clearancebeads.com/diyimages/29502126-4.jpg, http://www.clearancebeads.com/diyimages/29502126-5.jpg"
"34709524","900","Show your love for DC Comics with this Supergirl Bead Mix. Perfect to create a beautiful beaded necklace or bracelet. Show off your geek-chic passion for your favorite iconic characters.","Supergirl Bead Mix","DC Comics","","Multi","Acrylic","Acrylic Beads","",,"","","7-25mm","","Supergirl; Beads; DC comics","","N",999999,"",4.995,9.99,0,"http://www.clearancebeads.com/diyimages/34709524.jpg, http://www.clearancebeads.com/diyimages/34709524-2.jpg, http://www.clearancebeads.com/diyimages/34709524-3.jpg, http://www.clearancebeads.com/diyimages/34709524-4.jpg, http://www.clearancebeads.com/diyimages/34709524-5.jpg"
"47500501","900","This Purple mix of 30 4mm bicone beads offer the highest standard available on the market. The high-quality precision cutting and the clear through-hole achieve high brilliance and clarity. Rounded hole edges reduce the wear on thread and increase the durability of designs. They are available in the latest fashion colors, effects, and cuts. The main application techniques are beading, wiring, stringing, and weaving.","30pc Purple Bicone Mix","Swarovski","Light Amethyst, Tanzanite, Violet","Purple","Crystal","Beads","5328 Xilion Bead",,"","","4mm","30","Swarovski, Bicone, Beads, Mix, Purple","","N",999999,"",3,0,930,"http://www.clearancebeads.com/diyimages/47500501.jpg, http://www.clearancebeads.com/diyimages/47500501-2.jpg, http://www.clearancebeads.com/diyimages/47500501-3.jpg, http://www.clearancebeads.com/diyimages/47500501-4.jpg, http://www.clearancebeads.com/diyimages/47500501-5.jpg"
"47500509","900","This Star mix of 30 4mm bicone beads offer offer the highest standard available on the market. The high-quality precision cutting and the clear through-hole achieve high brilliance and clarity. Rounded hole edges reduce the wear on thread and increase the durability of designs. They are available in the latest fashion colors, effects, and cuts. The main application techniques are beading, wiring, stringing, and weaving.","30pc Star Bicone Mix","Swarovski","Black Diamond, Crystal, Golden Shadow, Vintage Ros","Multi","Crystal","Beads","5328 Xilion Bead",,"","","4mm","30","Swarovski, Bicone, Beads, Mix, Star","","N",999999,"",3,0,994,"http://www.clearancebeads.com/diyimages/47500509.jpg, http://www.clearancebeads.com/diyimages/47500509-2.jpg, http://www.clearancebeads.com/diyimages/47500509-3.jpg, http://www.clearancebeads.com/diyimages/47500509-4.jpg, http://www.clearancebeads.com/diyimages/47500509-5.jpg"
"47500505","900","This Pink mix of 30 4mm bicone beads offer offer the highest standard available on the market. The high-quality precision cutting and the clear through-hole achieve high brilliance and clarity. Rounded hole edges reduce the wear on thread and increase the durability of designs. They are available in the latest fashion colors, effects, and cuts. The main application techniques are beading, wiring, stringing, and weaving.","30pc Pink Bicone Mix","Swarovski","Light Rose, Rose Water Opal, Rose, Vintage Rose","Pink","Crystal","Beads","5328 Xilion Bead",,"","","4mm","30","Swarovski, Bicone, Beads, Mix, Pink","","N",999999,"",3,0,653,"http://www.clearancebeads.com/diyimages/47500505.jpg, http://www.clearancebeads.com/diyimages/47500505-2.jpg, http://www.clearancebeads.com/diyimages/47500505-3.jpg, http://www.clearancebeads.com/diyimages/47500505-4.jpg, http://www.clearancebeads.com/diyimages/47500505-5.jpg"
"47500504","900","This Green mix of 30 4mm bicone beads offer offer the highest standard available on the market. The high-quality precision cutting and the clear through-hole achieve high brilliance and clarity. Rounded hole edges reduce the wear on thread and increase the durability of designs. They are available in the latest fashion colors, effects, and cuts. The main application techniques are beading, wiring, stringing, and weaving.","30pc Green Bicone Mix","Swarovski","Chrysolite, Erinite, Peridot","Green","Crystal","Beads","5328 Xilion Bead",,"","","4mm","30","Swarovski, Bicone, Beads, Mix, Green","","N",999999,"",3,0,1183,"http://www.clearancebeads.com/diyimages/47500504.jpg, http://www.clearancebeads.com/diyimages/47500504-2.jpg, http://www.clearancebeads.com/diyimages/47500504-3.jpg, http://www.clearancebeads.com/diyimages/47500504-4.jpg, http://www.clearancebeads.com/diyimages/47500504-5.jpg"
"47500503","900","This Salt and Pepper mix of 30 4mm bicone beads offer offer the highest standard available on the market. The high-quality precision cutting and the clear through-hole achieve high brilliance and clarity. Rounded hole edges reduce the wear on thread and increase the durability of designs. They are available in the latest fashion colors, effects, and cuts. The main application techniques are beading, wiring, stringing, and weaving.","30pc Salt and Pepper Bicone Mix","Swarovski","Black Diamond, Crystal, Jet","Multi","Crystal","Beads","5328 Xilion Bead",,"","","4mm","30","Swarovski, Bicone, Beads, Mix, salt and pepper","","N",999999,"",3,0,845,"http://www.clearancebeads.com/diyimages/47500503.jpg, http://www.clearancebeads.com/diyimages/47500503-2.jpg, http://www.clearancebeads.com/diyimages/47500503-3.jpg, http://www.clearancebeads.com/diyimages/47500503-4.jpg, http://www.clearancebeads.com/diyimages/47500503-5.jpg"
"47500521","900","This Crystal White mix of 30 4mm bicone beads offer offer the highest standard available on the market. The high-quality precision cutting and the clear through-hole achieve high brilliance and clarity. Rounded hole edges reduce the wear on thread and increase the durability of designs. They are available in the latest fashion colors, effects, and cuts. The main application techniques are beading, wiring, stringing, and weaving.","30pc Crystal White Bicone Mix","Swarovski","Mix Crystal White: Crystal, White Opal, Crystal Ca","Multi","Crystal","Beads","5328 Xilion Bead",,"","","4mm","30","Swarovski, Bicone, Beads, Mix, Crystal White","","N",999999,"",3,0,742,"http://www.clearancebeads.com/diyimages/47500521.jpg, http://www.clearancebeads.com/diyimages/47500521-2.jpg, http://www.clearancebeads.com/diyimages/47500521-3.jpg, http://www.clearancebeads.com/diyimages/47500521-4.jpg, http://www.clearancebeads.com/diyimages/47500521-5.jpg"
"47500513","900","This Mojave mix of 30 4mm bicone beads offer offer the highest standard available on the market. The high-quality precision cutting and the clear through-hole achieve high brilliance and clarity. Rounded hole edges reduce the wear on thread and increase the durability of designs. They are available in the latest fashion colors, effects, and cuts. The main application techniques are beading, wiring, stringing, and weaving.","30pc Mojave Bicone Mix","Swarovski","Mix Mojave: Indian Sapphire, Lt Amethyst, Lt Smoke","Multi","Crystal","Beads","5328 Xilion Bead",,"","","4mm","30","Swarovski, Bicone, Beads, Mix, Mojave","","N",999999,"",3,0,926,"http://www.clearancebeads.com/diyimages/47500513.jpg, http://www.clearancebeads.com/diyimages/47500513-2.jpg, http://www.clearancebeads.com/diyimages/47500513-3.jpg, http://www.clearancebeads.com/diyimages/47500513-4.jpg, http://www.clearancebeads.com/diyimages/47500513-5.jpg"
"34771448","900","Use these shiny extender chain to comfortably wear a necklace or to create a long, dramatic piece of jewelry.","4pc Metal Multi pack Extend Chain","Findings","","Multi","Base Metal","Misc Tools","",,"Multi","Iron","2in","4","findings; extend chain","","N",999999,"",2,3.99,252,"http://www.clearancebeads.com/diyimages/34771448.jpg, http://www.clearancebeads.com/diyimages/34771448-2.jpg, http://www.clearancebeads.com/diyimages/34771448-3.jpg, http://www.clearancebeads.com/diyimages/34771448-4.jpg, http://www.clearancebeads.com/diyimages/34771448-5.jpg"
"34771745","900","Why not try using this classic black cord bracelet to make your very own bracelet! You can use add in some beads and charms to create a really unique design that will really stand out.","1pc Black Cord Bracelet","Finished Jewelry","","Black","Leather","Bracelets","",,"Silver","Iron","8in, 4mm","1","cord, bracelet","","N",999999,"",1.5,3,125,"http://www.clearancebeads.com/diyimages/34771745.jpg, http://www.clearancebeads.com/diyimages/34771745-2.jpg, http://www.clearancebeads.com/diyimages/34771745-3.jpg, http://www.clearancebeads.com/diyimages/34771745-4.jpg, http://www.clearancebeads.com/diyimages/34771745-5.jpg"
"47501508","900","This 15pc Sea Breeze mix of Bicone Beads offer the highest standard available on the market. The high-quality precision cutting and the clear through-hole achieve high brilliance and clarity. Rounded hole edges reduce the wear on thread and increase the durability of designs. They are available in the latest fashion colors, effects, and cuts. The main application techniques are beading, wiring, stringing, and weaving.","15pc Sea Breeze Bicone Mix","Swarovski","Aquamarine, Blue Zircon, Crystal Aurore Boreale, E","Multi","Crystal","Beads","5328 Xilion Bead",,"","","6mm","15","Swarovski, Bicone, Beads, Mix, Sea breeze","","N",999999,"",3,0,1327,"http://www.clearancebeads.com/diyimages/47501508.jpg, http://www.clearancebeads.com/diyimages/47501508-2.jpg, http://www.clearancebeads.com/diyimages/47501508-3.jpg, http://www.clearancebeads.com/diyimages/47501508-4.jpg, http://www.clearancebeads.com/diyimages/47501508-5.jpg"
"34699713","900","Our Zulaila bracelet Kit is the easiest way to create a beautiful piece of personalized jewelry. This bracelet kit contains 16 pieces that are color-coordinated for stylish visual impact. With the variety of pieces available in this jewelry making kit, and various options available, any bracelet you make will be funky and eye-catching. Combine these bracelet accents in any order to create an attractive accessory that suits your own style.","16pc Zulaila Large Hole Bead Kit","Kits","","Blue","Glass","Jewelry","",,"Silver","","","16","bracelet, kit, large hole bead, zulaila","","N",999999,"",5,0,469,"http://www.clearancebeads.com/diyimages/34699713.jpg, http://www.clearancebeads.com/diyimages/34699713-2.jpg, http://www.clearancebeads.com/diyimages/34699713-3.jpg, http://www.clearancebeads.com/diyimages/34699713-4.jpg, http://www.clearancebeads.com/diyimages/34699713-5.jpg"
"34699716","900","Our Marilyn bracelet Kit is the easiest way to create a beautiful piece of personalized jewelry. This bracelet kit contains 14 pieces that are color-coordinated for stylish visual impact. With the variety of pieces available in this jewelry making kit, and various options available, any bracelet you make will be funky and eye-catching. Combine these bracelet accents in any order to create an attractive accessory that suits your own style.","14pc Marylin Large Hole Bead Kit","Kits","","Multi","Glass","Jewelry","",,"Silver","","","14","bracelet, kit, large hole bead, Marylin","","N",999999,"",5,0,692,"http://www.clearancebeads.com/diyimages/34699716.jpg, http://www.clearancebeads.com/diyimages/34699716-2.jpg, http://www.clearancebeads.com/diyimages/34699716-3.jpg, http://www.clearancebeads.com/diyimages/34699716-4.jpg, http://www.clearancebeads.com/diyimages/34699716-5.jpg"
